432,Rangataua,Te Pahou Marae,Rangataua,Tribal,176.973188,-37.97919,"12K Pahou Pa Road, Poroporo",Ngāti Awa,Ngāti Rangataua,,"EBOP, R/O, TKM",Waikato-Waiariki,5407,"Rangataua | Te Pahou Marae | Rangataua | Ngati Awa | Ngati Rangataua | 12K Pahou Pa Road, Poroporo | Waikato-Waiariki","<a href=""mailto:tpkmaps@tpk.govt.nz?subject=Feedback on Rangataua - GIS_MID=432"">Send feedback on Rangataua</a>","<a href=""https://www.google.com/maps/place/-37.9791900000000,176.9731880000000/data=!3m1!1e3"">View location on Google Maps</a>"
433,Rangatira,,Whakahau,Tribal,177.857365,-38.46666,"66 Rangatira Road, Te Karaka",Te Aitanga ā Māhaki,Ngāti Wahia,Gisborne DC,"MFish, TKM",Ikaroa-Rāwhiti,4888,"Rangatira | Whakahau | Te Aitanga a Mahaki | Ngati Wahia | 66 Rangatira Road, Te Karaka | Ikaroa-Rawhiti","<a href=""mailto:tpkmaps@tpk.govt.nz?subject=Feedback on Rangatira - GIS_MID=433"">Send feedback on Rangatira</a>","<a href=""https://www.google.com/maps/place/-38.4666600000000,177.8573650000000/data=!3m1!1e3"">View location on Google Maps</a>"
434,Rangiāhua,,Te Poho o Tamaterangi,Tribal,177.314593,-38.939738,"331 Rangiahua Rd., Rangiahua","Ngāti Kahungunu, Te Wairoa iwi and hapu","Ngāi Tamaterangi, Ngāti Tamaterangi",kahungunu.iwi.nz,"F/S, TKM, WWW",Ikaroa-Rāwhiti,5144,"Rangiahua | Te Poho o Tamaterangi | Ngati Kahungunu, Te Wairoa iwi and hapu | Ngai Tamaterangi, Ngati Tamaterangi | 331 Rangiahua Rd., Rangiahua | Ikaroa-Rawhiti","<a href=""mailto:tpkmaps@tpk.govt.nz?subject=Feedback on Rangiāhua - GIS_MID=434"">Send feedback on Rangiāhua</a>","<a href=""https://www.google.com/maps/place/-38.9397380000000,177.3145930000000/data=!3m1!1e3"">View location on Google Maps</a>"
436,Rangikohu,,Ruia te Aroha,Tribal,173.201538755,-35.2582148907,"7 Settlement Way, Herekino, Kaitaia",Te Rarawa,"Ngāti Kurī, Te Aupōuri",terarawa.co.nz,"F/S, TKM, WWW",Te Taitokerau,4800,"Rangikohu | Ruia te Aroha | Te Rarawa | Ngati Kuri, Te Aupouri | 7 Settlement Way, Herekino, Kaitaia | Te Taitokerau","<a href=""mailto:tpkmaps@tpk.govt.nz?subject=Feedback on Rangikohu - GIS_MID=436"">Send feedback on Rangikohu</a>","<a href=""https://www.google.com/maps/place/-35.2582148906851,173.2015387545532/data=!3m1!1e3"">View location on Google Maps</a>"
438,Rangimarie,,Rarawhati,Tribal,176.978091,-37.98838,"281 Rewatu Rd., Poroporo",Ngāti Awa,Te Whānau o Tariao Tapuke,,"EBOP, TKM",Waikato-Waiariki,6228,"Rangimarie | Rarawhati | Ngati Awa | Te Whanau o Tariao Tapuke | 281 Rewatu Rd., Poroporo | Waikato-Waiariki","<a href=""mailto:tpkmaps@tpk.govt.nz?subject=Feedback on Rangimarie - GIS_MID=438"">Send feedback on Rangimarie</a>","<a href=""https://www.google.com/maps/place/-37.9883800000000,176.9780910000000/data=!3m1!1e3"">View location on Google Maps</a>"
981,Rangimarie Te Horanganui,,,,175.281209,-37.818068,"5 Collins Rd., Hamilton",,,,Pat Park,Waikato-Waiariki,0,"Rangimarie Te Horanganui | 5 Collins Rd., Hamilton | Waikato-Waiariki","<a href=""mailto:tpkmaps@tpk.govt.nz?subject=Feedback on Rangimarie Te Horanganui - GIS_MID=981"">Send feedback on Rangimarie Te Horanganui</a>","<a href=""https://www.google.com/maps/place/-37.8180680000000,175.2812090000000/data=!3m1!1e3"">View location on Google Maps</a>"
439,Rangitahi,,Apahapaitaketake,Tribal,176.715785,-38.460887,"32F Ngāti Manawa Road, Murupara",Ngāti Manawa,Ngāti Hui,,"EBOP, F/S, R/O, TKM",Waikato-Waiariki,4874,"Rangitahi | Apahapaitaketake | Ngati Manawa | Ngati Hui | 32F Ngati Manawa Road, Murupara | Waikato-Waiariki","<a href=""mailto:tpkmaps@tpk.govt.nz?subject=Feedback on Rangitahi - GIS_MID=439"">Send feedback on Rangitahi</a>","<a href=""https://www.google.com/maps/place/-38.4608870000000,176.7157850000000/data=!3m1!1e3"">View location on Google Maps</a>"
946,Rangitahi College,,Tuwhare,Institutional,176.719393,-38.465374,"Rangitahi College, Main Rd., Murupara",,,,"Pat Park, TKM",Waikato-Waiariki,6365,"Rangitahi College | Tuwhare | Rangitahi College, Main Rd., Murupara | Waikato-Waiariki","<a href=""mailto:tpkmaps@tpk.govt.nz?subject=Feedback on Rangitahi College - GIS_MID=946"">Send feedback on Rangitahi College</a>","<a href=""https://www.google.com/maps/place/-38.4653740000000,176.7193930000000/data=!3m1!1e3"">View location on Google Maps</a>"
440,Rangitihi,,Rangiaohia,Tribal,176.763325,-37.890522,"8 Marae Lane, Matatā",Ngāti Rangitihi,"Ngāti Mahi, Ngāti Rangitihi, Ngāti Tionga",,"EBOP, TKM",Waikato-Waiariki,5656,"Rangitihi | Rangiaohia | Ngati Rangitihi | Ngati Mahi, Ngati Rangitihi, Ngati Tionga | 8 Marae Lane, Matata | Waikato-Waiariki","<a href=""mailto:tpkmaps@tpk.govt.nz?subject=Feedback on Rangitihi - GIS_MID=440"">Send feedback on Rangitihi</a>","<a href=""https://www.google.com/maps/place/-37.8905220000000,176.7633250000000/data=!3m1!1e3"">View location on Google Maps</a>"
441,Rangiwaea,,Te Haka a Te Tupere,Tribal,176.122725,-37.637188,"Rangiwaea Island, Tauranga",Ngāi Te Rangi,Ngāi Tauwhao,,"EBOP, R/O, TKM",Waikato-Waiariki,4846,"Rangiwaea | Te Haka a Te Tupere | Ngai Te Rangi | Ngai Tauwhao | Rangiwaea Island, Tauranga | Waikato-Waiariki","<a href=""mailto:tpkmaps@tpk.govt.nz?subject=Feedback on Rangiwaea - GIS_MID=441"">Send feedback on Rangiwaea</a>","<a href=""https://www.google.com/maps/place/-37.6371880000000,176.1227250000000/data=!3m1!1e3"">View location on Google Maps</a>"
442,Rangiwaho,,Rangiwaho,Tribal,177.898365,-38.843756,"2840 SH2, Wharerata Rd., Bartletts",Ngāi Tāmanuhiri,"Ngāi Tawehi, Ngāti Kahutia, Ngāti Rangitauwhiwhia, Ngāti Rangiwaho, Ngāti Rangiwahomatua",Gisborne DC,"F/S, MFish, TKM",Ikaroa-Rāwhiti,5055,"Rangiwaho | Rangiwaho | Ngai Tamanuhiri | Ngai Tawehi, Ngati Kahutia, Ngati Rangitauwhiwhia, Ngati Rangiwaho, Ngati Rangiwahomatua | 2840 SH2, Wharerata Rd., Bartletts | Ikaroa-Rawhiti","<a href=""mailto:tpkmaps@tpk.govt.nz?subject=Feedback on Rangiwaho - GIS_MID=442"">Send feedback on Rangiwaho</a>","<a href=""https://www.google.com/maps/place/-38.8437560000000,177.8983650000000/data=!3m1!1e3"">View location on Google Maps</a>"
443,Rāpaki (Te Wheke),,Wheke,Tribal,172.68126,-43.606755,"39 Rāpaki Drive, Governors Bay",Ngāi Tahu,Te Hapū o Ngāti Wheke,whakapapa.maori.org.nz,"F/S, TKM, WWW",Te Waipounamu,4571,"Rapaki (Te Wheke) | Wheke | Ngai Tahu | Te Hapu o Ngati Wheke | 39 Rapaki Drive, Governors Bay | Te Waipounamu","<a href=""mailto:tpkmaps@tpk.govt.nz?subject=Feedback on Rāpaki (Te Wheke) - GIS_MID=443"">Send feedback on Rāpaki (Te Wheke)</a>","<a href=""https://www.google.com/maps/place/-43.6067550000000,172.6812600000000/data=!3m1!1e3"">View location on Google Maps</a>"
444,Rāroa,,Te Poho o Tanemoeahi,Tribal,177.056572,-38.182924,"233 Rāroa Pā Road, Waimana, Whakatane",Tūhoe,Tamaruarangi,,"EBOP, F/S, R/O, TKM",Waikato-Waiariki,6148,"Raroa | Te Poho o Tanemoeahi | Tuhoe | Tamaruarangi | 233 Raroa Pa Road, Waimana, Whakatane | Waikato-Waiariki","<a href=""mailto:tpkmaps@tpk.govt.nz?subject=Feedback on Rāroa - GIS_MID=444"">Send feedback on Rāroa</a>","<a href=""https://www.google.com/maps/place/-38.1829240000000,177.0565720000000/data=!3m1!1e3"">View location on Google Maps</a>"
445,Rātā (Te Hou Hou / Potaka),Potaka Marae,Hauiti,Tribal,175.515138,-40.001165,"43 Te Houhou Rd., Rata, Marton",Ngāti Hauiti,"Ngāti Ruaanga, Ngāti Tamateraka",,"F/S, TKM",Te Tai Hauāuru,4996,"Rata (Te Hou Hou / Potaka) | Potaka Marae | Hauiti | Ngati Hauiti | Ngati Ruaanga, Ngati Tamateraka | 43 Te Houhou Rd., Rata, Marton | Te Tai Hauauru","<a href=""mailto:tpkmaps@tpk.govt.nz?subject=Feedback on Rātā (Te Hou Hou / Potaka) - GIS_MID=445"">Send feedback on Rātā (Te Hou Hou / Potaka)</a>","<a href=""https://www.google.com/maps/place/-40.0011650000000,175.5151380000000/data=!3m1!1e3"">View location on Google Maps</a>"
1071,Ratana Pā,Manuao,Te Whare / The Big House,Institutional,175.174956,-40.038764,"Wharekauri Street, Ratana",,,,TKM,Te Tai Hauāuru,6384,"Ratana Pa | Manuao | Te Whare / The Big House | Wharekauri Street, Ratana | Te Tai Hauauru","<a href=""mailto:tpkmaps@tpk.govt.nz?subject=Feedback on Ratana Pā - GIS_MID=1071"">Send feedback on Ratana Pā</a>","<a href=""https://www.google.com/maps/place/-40.0387640000000,175.1749560000000/data=!3m1!1e3"">View location on Google Maps</a>"
448,Raukawa,,Raukawa,Tribal,175.141302,-40.753113,"90 Mill Rd., Ōtaki",Ngāti Raukawa ki te Tonga,"Ngāti Korokī, Ngāti Maiotaki, Ngāti Pare",whakapapa.maori.org.nz,"TKM, WWW",Te Tai Hauāuru,5020,"Raukawa | Raukawa | Ngati Raukawa ki te Tonga | Ngati Koroki, Ngati Maiotaki, Ngati Pare | 90 Mill Rd., Otaki | Te Tai Hauauru","<a href=""mailto:tpkmaps@tpk.govt.nz?subject=Feedback on Raukawa - GIS_MID=448"">Send feedback on Raukawa</a>","<a href=""https://www.google.com/maps/place/-40.7531130000000,175.1413020000000/data=!3m1!1e3"">View location on Google Maps</a>"
895,Raungaiti,,Te Oro,Tribal,175.738295,-37.738714,"6425 SH 27, Tamihana, Waharoa","Ngāti Hauā, Waikato","Ngāti Hauā, Ngāti Rangi Tawhaki, Ngāti Te Oro",,"Pat Park, TKM",Waikato-Waiariki,5128,"Raungaiti | Te Oro | Ngati Haua, Waikato | Ngati Haua, Ngati Rangi Tawhaki, Ngati Te Oro | 6425 SH 27, Tamihana, Waharoa | Waikato-Waiariki","<a href=""mailto:tpkmaps@tpk.govt.nz?subject=Feedback on Raungaiti - GIS_MID=895"">Send feedback on Raungaiti</a>","<a href=""https://www.google.com/maps/place/-37.7387140000000,175.7382950000000/data=!3m1!1e3"">View location on Google Maps</a>"
593,Raupunga,Te Huki Marae,Te Huki (being rebuilt),Tribal,177.146935,-39.071301,"36 Putere Rd., Raupunga","Ngāti Kahungunu, Ngāti Pāhauwera","Ngā Uri-o-Māmangu, Ngāi Tahu, Ngāi Tāne, Ngāi Tāpui, Ngāi Taumau, Ngāi Te Ao Kapiti / Aukapiti, Ngāi Te Aonui, Ngāi Te Āwhā, Ngāi Te Huki, Ngāi Te Ngau Pātea, Ngāi Te Rau, Ngāi Te Rauiri, Ngāi Te Rongo, Ngāi Te Ruatai, Ngāi Te Ruruku",,"R/O, TKM",Ikaroa-Rāwhiti,6215,"Raupunga | Te Huki Marae | Te Huki (being rebuilt) | Ngati Kahungunu, Ngati Pahauwera | Nga Uri-o-Mamangu, Ngai Tahu, Ngai Tane, Ngai Tapui, Ngai Taumau, Ngai Te Ao Kapiti / Aukapiti, Ngai Te Aonui, Ngai Te Awha, Ngai Te Huki, Ngai Te Ngau Patea, Ngai Te","<a href=""mailto:tpkmaps@tpk.govt.nz?subject=Feedback on Raupunga - GIS_MID=593"">Send feedback on Raupunga</a>","<a href=""https://www.google.com/maps/place/-39.0713010000000,177.1469350000000/data=!3m1!1e3"">View location on Google Maps</a>"
449,Rauru,,Rauru Nui a Toi,Tribal,178.29965,-37.897822,"32 Harrison Road, Ruatōria",Ngāti Porou,Te Whānau a Hinekehu,Gisborne DC,"F/S, MFish, TKM",Ikaroa-Rāwhiti,5755,"Rauru | Rauru Nui a Toi | Ngati Porou | Te Whanau a Hinekehu | 32 Harrison Road, Ruatoria | Ikaroa-Rawhiti","<a href=""mailto:tpkmaps@tpk.govt.nz?subject=Feedback on Rauru - GIS_MID=449"">Send feedback on Rauru</a>","<a href=""https://www.google.com/maps/place/-37.8978220000000,178.2996500000000/data=!3m1!1e3"">View location on Google Maps</a>"
450,Rautahi,,Te Aotahi,Urban,176.698981,-38.090295,"117 Onslow Street, Kawerau",,,,"EBOP, F/S, R/O, TKM",Waikato-Waiariki,6283,"Rautahi | Te Aotahi | 117 Onslow Street, Kawerau | Waikato-Waiariki","<a href=""mailto:tpkmaps@tpk.govt.nz?subject=Feedback on Rautahi - GIS_MID=450"">Send feedback on Rautahi</a>","<a href=""https://www.google.com/maps/place/-38.0902950000000,176.6989810000000/data=!3m1!1e3"">View location on Google Maps</a>"
453,Rāwhitiroa,,Rāwhitiroa,Tribal,174.212737266,-36.1731274508,"91 Karakanui Road, Tinopai","Ngāti Whātua, Te Uri o Hau","Ngāi Tāhuhu, Ngāti Kaiwhare, Ngāti Kauae, Ngāti Kura, Ngāti Mauku, Ngāti Rangi, Ngāti Tāhinga, Te Popoto, Te Uri o Hau",,TKM,Te Taitokerau,6036,"Rawhitiroa | Rawhitiroa | Ngati Whatua, Te Uri o Hau | Ngai Tahuhu, Ngati Kaiwhare, Ngati Kauae, Ngati Kura, Ngati Mauku, Ngati Rangi, Ngati Tahinga, Te Popoto, Te Uri o Hau | 91 Karakanui Road, Tinopai | Te Taitokerau","<a href=""mailto:tpkmaps@tpk.govt.nz?subject=Feedback on Rāwhitiroa - GIS_MID=453"">Send feedback on Rāwhitiroa</a>","<a href=""https://www.google.com/maps/place/-36.1731274507877,174.2127372663464/data=!3m1!1e3"">View location on Google Maps</a>"
451,Rāwhitiroa (Ōwairaka),,Takihiku,Tribal,175.438125,-38.106393,"46 Bayley Rd., Parawera","Raukawa, Waikato","Ngāti Kiri, Ngāti Korokī, Ngāti Raukawa ki Panehākua, Ngāti Takihiku, Ngāti Whakatere, Rereahu",whakapapa.maori.org.nz,"TKM, WWW",Waikato-Waiariki,5113,"Rawhitiroa (Owairaka) | Takihiku | Raukawa, Waikato | Ngati Kiri, Ngati Koroki, Ngati Raukawa ki Panehakua, Ngati Takihiku, Ngati Whakatere, Rereahu | 46 Bayley Rd., Parawera | Waikato-Waiariki","<a href=""mailto:tpkmaps@tpk.govt.nz?subject=Feedback on Rāwhitiroa (Ōwairaka) - GIS_MID=451"">Send feedback on Rāwhitiroa (Ōwairaka)</a>","<a href=""https://www.google.com/maps/place/-38.1063930000000,175.4381250000000/data=!3m1!1e3"">View location on Google Maps</a>"
452,Rāwhitiroa (Te Ahuahu),,Rawhitiroa,Tribal,173.839034,-35.333,"444D SH1, Te Ahuahu, Kaikohe",Ngāpuhi,"Ngāti Hineira, Te Kapotai, Te Popoto, Te Uri Taniwha",,TKM,Te Taitokerau,5449,"Rawhitiroa (Te Ahuahu) | Rawhitiroa | Ngapuhi | Ngati Hineira, Te Kapotai, Te Popoto, Te Uri Taniwha | 444D SH1, Te Ahuahu, Kaikohe | Te Taitokerau","<a href=""mailto:tpkmaps@tpk.govt.nz?subject=Feedback on Rāwhitiroa (Te Ahuahu) - GIS_MID=452"">Send feedback on Rāwhitiroa (Te Ahuahu)</a>","<a href=""https://www.google.com/maps/place/-35.3330000000000,173.8390340000000/data=!3m1!1e3"">View location on Google Maps</a>"
907,Rehua,,Te Whatu Manawa Māoritanga o Rehua,Institutional,172.631212,-43.516708,"79 Springfield Road, Edgeware, Christchurch",,,https://rehuamarae.co.nz,"Pat Park, TKM",Te Waipounamu,6434,"Rehua | Te Whatu Manawa Maoritanga o Rehua | 79 Springfield Road, Edgeware, Christchurch | Te Waipounamu","<a href=""mailto:tpkmaps@tpk.govt.nz?subject=Feedback on Rehua - GIS_MID=907"">Send feedback on Rehua</a>","<a href=""https://www.google.com/maps/place/-43.5167080000000,172.6312120000000/data=!3m1!1e3"">View location on Google Maps</a>"
454,Rengarenga,,No wharenui,Tribal,175.858877555,-37.9027219879,"1 Papatangi Rd., Te Poi, Matamata",Raukawa,"Ngāti Mōtai, Ngāti Te Apunga",,TKM,Waikato-Waiariki,6073,"Rengarenga | No wharenui | Raukawa | Ngati Motai, Ngati Te Apunga | 1 Papatangi Rd., Te Poi, Matamata | Waikato-Waiariki","<a href=""mailto:tpkmaps@tpk.govt.nz?subject=Feedback on Rengarenga - GIS_MID=454"">Send feedback on Rengarenga</a>","<a href=""https://www.google.com/maps/place/-37.9027219879127,175.8588775553418/data=!3m1!1e3"">View location on Google Maps</a>"
455,Reporua,Tu Auau Marae,Tū Auau,Tribal,178.404148,-37.875001,"634 Reporua Road, Ruatōria",Ngāti Porou,Ngāti Rangi,Gisborne DC,"F/S, MFish, TKM",Ikaroa-Rāwhiti,5765,"Reporua | Tu Auau Marae | Tu Auau | Ngati Porou | Ngati Rangi | 634 Reporua Road, Ruatoria | Ikaroa-Rawhiti","<a href=""mailto:tpkmaps@tpk.govt.nz?subject=Feedback on Reporua - GIS_MID=455"">Send feedback on Reporua</a>","<a href=""https://www.google.com/maps/place/-37.8750010000000,178.4041480000000/data=!3m1!1e3"">View location on Google Maps</a>"
457,Rereamanu,,Te Kawau Kaki Maro I & II,Tribal,175.194281,-38.236847,"465 Te Kuiti Rd., Ōtorohanga",Maniapoto,"Huiao, Te Kanawa",Otorohanga DC,"F/S, MFish, TKM",Waikato-Waiariki,4653,"Rereamanu | Te Kawau Kaki Maro I & II | Maniapoto | Huiao, Te Kanawa | 465 Te Kuiti Rd., Otorohanga | Waikato-Waiariki","<a href=""mailto:tpkmaps@tpk.govt.nz?subject=Feedback on Rereamanu - GIS_MID=457"">Send feedback on Rereamanu</a>","<a href=""https://www.google.com/maps/place/-38.2368470000000,175.1942810000000/data=!3m1!1e3"">View location on Google Maps</a>"
458,Reretēwhioi,,Arohanui,Tribal,174.697247,-37.23974,"83 Tahurangatira Rd., Waipipi, Waiuku",Waikato,"Ngāti Paretaua, Ngāti Te Ata, Te Ākitai",whakapapa.maori.org.nz,"TKM, WWW",Tāmaki Makaurau,5084,"Reretewhioi | Arohanui | Waikato | Ngati Paretaua, Ngati Te Ata, Te Akitai | 83 Tahurangatira Rd., Waipipi, Waiuku | Tamaki Makaurau","<a href=""mailto:tpkmaps@tpk.govt.nz?subject=Feedback on Reretēwhioi - GIS_MID=458"">Send feedback on Reretēwhioi</a>","<a href=""https://www.google.com/maps/place/-37.2397400000000,174.6972470000000/data=!3m1!1e3"">View location on Google Maps</a>"
691,Rewarewa,,Te Rangimoaho; Kuramihirangi,Tribal,177.004932,-38.140263,"11 Te Wakaunua Road, Rūātoki",Tūhoe,Te Māhurehure,,"EBOP, F/S, R/O, TKM",Waikato-Waiariki,6132,"Rewarewa | Te Rangimoaho; Kuramihirangi | Tuhoe | Te Mahurehure | 11 Te Wakaunua Road, Ruatoki | Waikato-Waiariki","<a href=""mailto:tpkmaps@tpk.govt.nz?subject=Feedback on Rewarewa - GIS_MID=691"">Send feedback on Rewarewa</a>","<a href=""https://www.google.com/maps/place/-38.1402630000000,177.0049320000000/data=!3m1!1e3"">View location on Google Maps</a>"
459,Rewatu,,Ueimua,Tribal,176.980634,-37.998573,"440 Rewatu Road, Poroporo",Ngāti Awa,Ngāi Tamapare,,"EBOP, R/O, TKM",Waikato-Waiariki,5408,"Rewatu | Ueimua | Ngati Awa | Ngai Tamapare | 440 Rewatu Road, Poroporo | Waikato-Waiariki","<a href=""mailto:tpkmaps@tpk.govt.nz?subject=Feedback on Rewatu - GIS_MID=459"">Send feedback on Rewatu</a>","<a href=""https://www.google.com/maps/place/-37.9985730000000,176.9806340000000/data=!3m1!1e3"">View location on Google Maps</a>"
460,Reweti,,Whiti te Rā,Tribal,174.454794,-36.75897,"1283 SH16, Rewiti, Waimauku","Ngāti Whātua, Ngāti Whātua o Kaipara",Te Taoū,Rodney DC,"F/S, MFish, TKM",Tāmaki Makaurau,6051,"Reweti | Whiti te Ra | Ngati Whatua, Ngati Whatua o Kaipara | Te Taou | 1283 SH16, Rewiti, Waimauku | Tamaki Makaurau","<a href=""mailto:tpkmaps@tpk.govt.nz?subject=Feedback on Reweti - GIS_MID=460"">Send feedback on Reweti</a>","<a href=""https://www.google.com/maps/place/-36.7589700000000,174.4547940000000/data=!3m1!1e3"">View location on Google Maps</a>"
461,Rīpia,,No wharenui,Tribal,173.953051,-36.081583,"1625 Pouto Road, Rīpia","Ngāti Whātua, Te Uri o Hau","Ngāi Tāhuhu, Ngāti Kaiwhare, Ngāti Kauae, Ngāti Kura, Ngāti Mauku, Ngāti Rangi, Ngāti Tāhinga, Te Uri o Hau",whakapapa.maori.org.nz,"TKM, WWW",Te Taitokerau,6024,"Ripia | No wharenui | Ngati Whatua, Te Uri o Hau | Ngai Tahuhu, Ngati Kaiwhare, Ngati Kauae, Ngati Kura, Ngati Mauku, Ngati Rangi, Ngati Tahinga, Te Uri o Hau | 1625 Pouto Road, Ripia | Te Taitokerau","<a href=""mailto:tpkmaps@tpk.govt.nz?subject=Feedback on Rīpia - GIS_MID=461"">Send feedback on Rīpia</a>","<a href=""https://www.google.com/maps/place/-36.0815830000000,173.9530510000000/data=!3m1!1e3"">View location on Google Maps</a>"
462,Roimata,,Te Ao Marama,Tribal,177.130075,-38.033228,"200 Hiwarau Road, Kutarere, Opotiki",Whakatōhea,Te Ūpokorehe,,"EBOP, F/S, R/O, TKM",Waikato-Waiariki,4872,"Roimata | Te Ao Marama | Whakatohea | Te Upokorehe | 200 Hiwarau Road, Kutarere, Opotiki | Waikato-Waiariki","<a href=""mailto:tpkmaps@tpk.govt.nz?subject=Feedback on Roimata - GIS_MID=462"">Send feedback on Roimata</a>","<a href=""https://www.google.com/maps/place/-38.0332280000000,177.1300750000000/data=!3m1!1e3"">View location on Google Maps</a>"
463,Roma,Te Ohaki Marae,Te Ōhākī,Tribal,173.158038,-35.180889,"134 Roma Road, Ahipara, Kaitaia",Te Rarawa,"Ngāti Pākahi, Ngāti Waiora, Parewhero, Te Patukirikiri",terarawa.co.nz,"TKM, WWW",Te Taitokerau,4805,"Roma | Te Ohaki Marae | Te Ohaki | Te Rarawa | Ngati Pakahi, Ngati Waiora, Parewhero, Te Patukirikiri | 134 Roma Road, Ahipara, Kaitaia | Te Taitokerau","<a href=""mailto:tpkmaps@tpk.govt.nz?subject=Feedback on Roma - GIS_MID=463"">Send feedback on Roma</a>","<a href=""https://www.google.com/maps/place/-35.1808890000000,173.1580380000000/data=!3m1!1e3"">View location on Google Maps</a>"
903,Rongo o Tahu,,No wharenui,Tribal,176.35400489,-40.0270642239,Paulsens Stock Route Takapau,"Ngāti Kahungunu, Ngāti Kahungunu ki Heretaunga Tamatea","Ngai Tahu ki Takapau, Ngāi Tahu o Kahungunu",,"TKM, WWW",Ikaroa-Rāwhiti,5227,"Rongo o Tahu | No wharenui | Ngati Kahungunu, Ngati Kahungunu ki Heretaunga Tamatea | Ngai Tahu ki Takapau, Ngai Tahu o Kahungunu | Paulsens Stock Route Takapau | Ikaroa-Rawhiti","<a href=""mailto:tpkmaps@tpk.govt.nz?subject=Feedback on Rongo o Tahu - GIS_MID=903"">Send feedback on Rongo o Tahu</a>","<a href=""https://www.google.com/maps/place/-40.0270642239126,176.3540048904338/data=!3m1!1e3"">View location on Google Maps</a>"
465,Rongohaere,,Rongohaere,Tribal,178.242963,-37.953855,"29 Makarika Road, Ruatōria","Ngāti Porou, Te Whānau a Apanui","Te Aitanga a Mate, Te Whānau a Rākairoa, Te Whānau a Rutaia",Gisborne DC,"F/S, MFish, TKM",Ikaroa-Rāwhiti,5747,"Rongohaere | Rongohaere | Ngati Porou, Te Whanau a Apanui | Te Aitanga a Mate, Te Whanau a Rakairoa, Te Whanau a Rutaia | 29 Makarika Road, Ruatoria | Ikaroa-Rawhiti","<a href=""mailto:tpkmaps@tpk.govt.nz?subject=Feedback on Rongohaere - GIS_MID=465"">Send feedback on Rongohaere</a>","<a href=""https://www.google.com/maps/place/-37.9538550000000,178.2429630000000/data=!3m1!1e3"">View location on Google Maps</a>"
466,Rongomai,,Rongomai,Tribal,175.838084,-38.978285,"96 Waiotaka Rd., Tūrangi",Ngāti Tūwharetoa,Ngāti Rongomai,,TKM,Waikato-Waiariki,5321,"Rongomai | Rongomai | Ngati Tuwharetoa | Ngati Rongomai | 96 Waiotaka Rd., Turangi | Waikato-Waiariki","<a href=""mailto:tpkmaps@tpk.govt.nz?subject=Feedback on Rongomai - GIS_MID=466"">Send feedback on Rongomai</a>","<a href=""https://www.google.com/maps/place/-38.9782850000000,175.8380840000000/data=!3m1!1e3"">View location on Google Maps</a>"
467,Rongomaipapa,,Maruahangaroa,Tribal,176.157826,-38.265192,"170 Rongomai Rd., Horohoro",Ngāti Kea / Ngāti Tuarā,"Ngāti Kearoa, Ngāti Tuarā",,"F/S, TKM",Waikato-Waiariki,5719,"Rongomaipapa | Maruahangaroa | Ngati Kea / Ngati Tuara | Ngati Kearoa, Ngati Tuara | 170 Rongomai Rd., Horohoro | Waikato-Waiariki","<a href=""mailto:tpkmaps@tpk.govt.nz?subject=Feedback on Rongomaipapa - GIS_MID=467"">Send feedback on Rongomaipapa</a>","<a href=""https://www.google.com/maps/place/-38.2651920000000,176.1578260000000/data=!3m1!1e3"">View location on Google Maps</a>"
468,Rongomaraeroa,Porangahau Marae,Te Poho o Kahungunu,Tribal,176.611897,-40.308085,"27 Pā Road, Pōrangahau","Ngāti Kahungunu, Ngāti Kahungunu ki Heretaunga Tamatea","Ngati Hinetewai, Ngāti Hinetewai, Ngati Kere, Ngāti Kere, Ngati Manuhiri, Ngāti Manuhiri, Ngāti Pihere, Ngāti Pīhere, Ngāti Tamatea, Tamatea Hinepare o Kahungunu",kahungunu.iwi.nz,"TKM, WWW",Ikaroa-Rāwhiti,5232,"Rongomaraeroa | Porangahau Marae | Te Poho o Kahungunu | Ngati Kahungunu, Ngati Kahungunu ki Heretaunga Tamatea | Ngati Hinetewai, Ngati Hinetewai, Ngati Kere, Ngati Kere, Ngati Manuhiri, Ngati Manuhiri, Ngati Pihere, Ngati Pihere, Ngati Tamatea, Tamatea","<a href=""mailto:tpkmaps@tpk.govt.nz?subject=Feedback on Rongomaraeroa - GIS_MID=468"">Send feedback on Rongomaraeroa</a>","<a href=""https://www.google.com/maps/place/-40.3080850000000,176.6118970000000/data=!3m1!1e3"">View location on Google Maps</a>"
469,Rongopai,,Rongopai,Tribal,177.896562,-38.584636,"473 Lavenham Road, Waituhi",Te Aitanga ā Māhaki,Te Whānau a Kai,Gisborne DC,"F/S, MFish, TKM",Ikaroa-Rāwhiti,4898,"Rongopai | Rongopai | Te Aitanga a Mahaki | Te Whanau a Kai | 473 Lavenham Road, Waituhi | Ikaroa-Rawhiti","<a href=""mailto:tpkmaps@tpk.govt.nz?subject=Feedback on Rongopai - GIS_MID=469"">Send feedback on Rongopai</a>","<a href=""https://www.google.com/maps/place/-38.5846360000000,177.8965620000000/data=!3m1!1e3"">View location on Google Maps</a>"
1036,Rongopopoia (Te Kahikatea),,Rongopopoia,Tribal,177.17819,-38.150454,"1762 Waiotahi Valley Rd., Ōpōtiki",Tūhoe,Upokorehe,,"Pat Park, TKM",Waikato-Waiariki,6179,"Rongopopoia (Te Kahikatea) | Rongopopoia | Tuhoe | Upokorehe | 1762 Waiotahi Valley Rd., Opotiki | Waikato-Waiariki","<a href=""mailto:tpkmaps@tpk.govt.nz?subject=Feedback on Rongopopoia (Te Kahikatea) - GIS_MID=1036"">Send feedback on Rongopopoia (Te Kahikatea)</a>","<a href=""https://www.google.com/maps/place/-38.1504540000000,177.1781900000000/data=!3m1!1e3"">View location on Google Maps</a>"
916,Rongotai College,,Tangi Te Keo,Institutional,174.80123,-41.321802,"Rongotai College, 170 Coutts St., Kilbirnie, Wellington",,,,"Pat Park, TKM",Te Tai Hauāuru,6396,"Rongotai College | Tangi Te Keo | Rongotai College, 170 Coutts St., Kilbirnie, Wellington | Te Tai Hauauru","<a href=""mailto:tpkmaps@tpk.govt.nz?subject=Feedback on Rongotai College - GIS_MID=916"">Send feedback on Rongotai College</a>","<a href=""https://www.google.com/maps/place/-41.3218020000000,174.8012300000000/data=!3m1!1e3"">View location on Google Maps</a>"
470,Rotowhio,NZ Maori Arts and Crafts Institute,Rotowhio,Institutional,176.250657,-38.16427,"Te Puia, Hemo Gorge Rd., Whakarewarewa",,,,"EBOP, TKM",Waikato-Waiariki,6355,"Rotowhio | NZ Maori Arts and Crafts Institute | Rotowhio | Te Puia, Hemo Gorge Rd., Whakarewarewa | Waikato-Waiariki","<a href=""mailto:tpkmaps@tpk.govt.nz?subject=Feedback on Rotowhio - GIS_MID=470"">Send feedback on Rotowhio</a>","<a href=""https://www.google.com/maps/place/-38.1642700000000,176.2506570000000/data=!3m1!1e3"">View location on Google Maps</a>"
471,Ruahāpia,,Karaitiana Takamoana,Tribal,176.87890728,-39.6203576397,"71 Ruahapia Road, Hastings","Ngāti Kahungunu, Ngāti Kahungunu ki Heretaunga Tamatea","Ngāti Hāwea, Ngati Hōri",kahungunu.iwi.nz,"F/S, TKM, WWW",Ikaroa-Rāwhiti,5196,"Ruahapia | Karaitiana Takamoana | Ngati Kahungunu, Ngati Kahungunu ki Heretaunga Tamatea | Ngati Hawea, Ngati Hori | 71 Ruahapia Road, Hastings | Ikaroa-Rawhiti","<a href=""mailto:tpkmaps@tpk.govt.nz?subject=Feedback on Ruahāpia - GIS_MID=471"">Send feedback on Ruahāpia</a>","<a href=""https://www.google.com/maps/place/-39.6203576396552,176.8789072799862/data=!3m1!1e3"">View location on Google Maps</a>"
