925,Ministry of Foreign Affairs and Trade,,Ngāti Aorere,Institutional,174.775687179,-41.2840487081,"Ministry of Foreign Affairs and Trade, 195 Lambton Quay, Wellington",,,,"Pat Park, TKM",Te Tai Hauāuru,6393,"Ministry of Foreign Affairs and Trade | Ngati Aorere | Ministry of Foreign Affairs and Trade, 195 Lambton Quay, Wellington | Te Tai Hauauru","<a href=""mailto:tpkmaps@tpk.govt.nz?subject=Feedback on Ministry of Foreign Affairs and Trade - GIS_MID=925"">Send feedback on Ministry of Foreign Affairs and Trade</a>","<a href=""https://www.google.com/maps/place/-41.2840487080672,174.7756871787520/data=!3m1!1e3"">View location on Google Maps</a>"
216,Miria,Te Rapunga Marae,Te Rapunga,Tribal,174.072405,-35.411274,"5101 SH1, Waiomio, Bay of Islands",Ngāpuhi,Ngāti Hine,whakapapa.maori.org.nz,"TKM, WWW",Te Taitokerau,5507,"Miria | Te Rapunga Marae | Te Rapunga | Ngapuhi | Ngati Hine | 5101 SH1, Waiomio, Bay of Islands | Te Taitokerau","<a href=""mailto:tpkmaps@tpk.govt.nz?subject=Feedback on Miria - GIS_MID=216"">Send feedback on Miria</a>","<a href=""https://www.google.com/maps/place/-35.4112740000000,174.0724050000000/data=!3m1!1e3"">View location on Google Maps</a>"
636,Miringa te Kakara,Temple of the Four Winds; The Crosshouse,Te Whetū Marama o Ngā Tau o Hinawa,Tribal,175.471158,-38.517817,"SH30, Pureora","Maniapoto, Rereahu","Ngāti Hinewhatihua, Ngāti Kahuiao, Ngāti Ngutu, Ngāti Pahere, Ngāti Paretapoko, Ngāti Pikiahu, Ngāti Te Peehi, Ngāti Te Rā, Ngāti Turakiwai, Ngāti Tuwhakahekeao, Ngāti Urunumia, Ngāti Waewae, Ngāti Whakatere, Rereahu, Te Ihingarangi",,TKM,Waikato-Waiariki,4706,"Miringa te Kakara | Temple of the Four Winds; The Crosshouse | Te Whetu Marama o Nga Tau o Hinawa | Maniapoto, Rereahu | Ngati Hinewhatihua, Ngati Kahuiao, Ngati Ngutu, Ngati Pahere, Ngati Paretapoko, Ngati Pikiahu, Ngati Te Peehi, Ngati Te Ra, Ngati Tur","<a href=""mailto:tpkmaps@tpk.govt.nz?subject=Feedback on Miringa te Kakara - GIS_MID=636"">Send feedback on Miringa te Kakara</a>","<a href=""https://www.google.com/maps/place/-38.5178170000000,175.4711580000000/data=!3m1!1e3"">View location on Google Maps</a>"
1054,Mirinoa,Te Wahi Reka Te Kohanga Reo,,,175.668954,-40.961176,"13A River Rd., Masterton",,,,Survey,Ikaroa-Rāwhiti,0,"Mirinoa | Te Wahi Reka Te Kohanga Reo | 13A River Rd., Masterton | Ikaroa-Rawhiti","<a href=""mailto:tpkmaps@tpk.govt.nz?subject=Feedback on Mirinoa - GIS_MID=1054"">Send feedback on Mirinoa</a>","<a href=""https://www.google.com/maps/place/-40.9611760000000,175.6689540000000/data=!3m1!1e3"">View location on Google Maps</a>"
233,Mo te Katoa,,Motekatoa,Tribal,175.283277,-39.421848,"7674 Valley Rd., Raetihi","Ngāti Rangi, Te Korowai o Wainuiārua (Central Whanganui), Whanganui Iwi / Te Atihaunui a Pāpārangi","Ngāti Atamira, Ngāti Hinekura, Ngāti Maringi, Ngāti Pare, Ngāti Patutokotoko, Ngāti Rangi ki Manganui-o-te-Ao, Ngāti Tamakana, Ngāti Tara, Ngāti Tauengarero, Ngāti Tukaiora, Ngāti Uenuku, Patutokotoko, Uenukumanawawiri",,TKM,Te Tai Hauāuru,6199,"Mo te Katoa | Motekatoa | Ngati Rangi, Te Korowai o Wainuiarua (Central Whanganui), Whanganui Iwi / Te Atihaunui a Paparangi | Ngati Atamira, Ngati Hinekura, Ngati Maringi, Ngati Pare, Ngati Patutokotoko, Ngati Rangi ki Manganui-o-te-Ao, Ngati Tamakana,","<a href=""mailto:tpkmaps@tpk.govt.nz?subject=Feedback on Mo te Katoa - GIS_MID=233"">Send feedback on Mo te Katoa</a>","<a href=""https://www.google.com/maps/place/-39.4218480000000,175.2832770000000/data=!3m1!1e3"">View location on Google Maps</a>"
217,Moehau,,Moehau,Tribal,173.614189,-35.442156,"2 Mission Oak Rd., Waimā Valley, South Hokianga",Ngāpuhi,Te Māhurehure,whakapapa.maori.org.nz,"F/S, TKM, WWW",Te Taitokerau,5575,"Moehau | Moehau | Ngapuhi | Te Mahurehure | 2 Mission Oak Rd., Waima Valley, South Hokianga | Te Taitokerau","<a href=""mailto:tpkmaps@tpk.govt.nz?subject=Feedback on Moehau - GIS_MID=217"">Send feedback on Moehau</a>","<a href=""https://www.google.com/maps/place/-35.4421560000000,173.6141890000000/data=!3m1!1e3"">View location on Google Maps</a>"
218,Moeraki,,Uenuku,Tribal,170.856709,-45.361607,"Cnr. Tenby St. and Te Karita Road, Moeraki",Ngāi Tahu,Te Rūnanga o Moeraki,whakapapa.maori.org.nz,"F/S, TKM, WWW",Te Waipounamu,4576,"Moeraki | Uenuku | Ngai Tahu | Te Runanga o Moeraki | Cnr. Tenby St. and Te Karita Road, Moeraki | Te Waipounamu","<a href=""mailto:tpkmaps@tpk.govt.nz?subject=Feedback on Moeraki - GIS_MID=218"">Send feedback on Moeraki</a>","<a href=""https://www.google.com/maps/place/-45.3616070000000,170.8567090000000/data=!3m1!1e3"">View location on Google Maps</a>"
219,Moewhare (Karangaranga),Karangaranga Marae,Moewhare,Tribal,176.714788,-38.405498,"1027 Kopuriki Road, Murupara",Ngāti Manawa,Moewhare,,"EBOP, R/O, TKM",Waikato-Waiariki,4876,"Moewhare (Karangaranga) | Karangaranga Marae | Moewhare | Ngati Manawa | Moewhare | 1027 Kopuriki Road, Murupara | Waikato-Waiariki","<a href=""mailto:tpkmaps@tpk.govt.nz?subject=Feedback on Moewhare (Karangaranga) - GIS_MID=219"">Send feedback on Moewhare (Karangaranga)</a>","<a href=""https://www.google.com/maps/place/-38.4054980000000,176.7147880000000/data=!3m1!1e3"">View location on Google Maps</a>"
220,Mohinui,,Hohourongo,Tribal,174.087257411,-35.4244213077,"234 Waiomio Rd., Waiomio, Bay of Islands",Ngāpuhi,"Ngāti Hine, Ngāti Kahu o Torongare",,"F/S, TKM",Te Taitokerau,5510,"Mohinui | Hohourongo | Ngapuhi | Ngati Hine, Ngati Kahu o Torongare | 234 Waiomio Rd., Waiomio, Bay of Islands | Te Taitokerau","<a href=""mailto:tpkmaps@tpk.govt.nz?subject=Feedback on Mohinui - GIS_MID=220"">Send feedback on Mohinui</a>","<a href=""https://www.google.com/maps/place/-35.4244213077023,174.0872574111073/data=!3m1!1e3"">View location on Google Maps</a>"
341,Mōkai,Pakeketaiari Marae,Pakake Taiari,Tribal,175.904228,-38.527153,"1461 Tirohanga Rd., Mōkai","Ngāti Tūwharetoa, Pouākani, Raukawa","Ngāti Hā, Ngāti Moekino, Ngāti Parekāwa, Ngāti Tarakaiahi, Ngāti Te Kohera, Ngāti Wairangi, Ngāti Whaita",whakapapa.maori.org.nz,"TKM, WWW",Waikato-Waiariki,5304,"Mokai | Pakeketaiari Marae | Pakake Taiari | Ngati Tuwharetoa, Pouakani, Raukawa | Ngati Ha, Ngati Moekino, Ngati Parekawa, Ngati Tarakaiahi, Ngati Te Kohera, Ngati Wairangi, Ngati Whaita | 1461 Tirohanga Rd., Mokai | Waikato-Waiariki","<a href=""mailto:tpkmaps@tpk.govt.nz?subject=Feedback on Mōkai - GIS_MID=341"">Send feedback on Mōkai</a>","<a href=""https://www.google.com/maps/place/-38.5271530000000,175.9042280000000/data=!3m1!1e3"">View location on Google Maps</a>"
924,Mokai Kainga,Marae in the sky,,Urban,174.776506974,-41.2873858426,"Level 7, 44 Victoria St., Wellington",,,,Pat Park,Te Tai Hauāuru,0,"Mokai Kainga | Marae in the sky | Level 7, 44 Victoria St., Wellington | Te Tai Hauauru","<a href=""mailto:tpkmaps@tpk.govt.nz?subject=Feedback on Mokai Kainga - GIS_MID=924"">Send feedback on Mokai Kainga</a>","<a href=""https://www.google.com/maps/place/-41.2873858426062,174.7765069735972/data=!3m1!1e3"">View location on Google Maps</a>"
221,Mōkai Kainga,,Ko Te Mōkai,Tribal,174.839546,-38.035788,"111 Aotea Rd., Kāwhia","Maniapoto, Waikato","Apakura, Hikairo, Ngāti Apakura",Otorohanga DC,"MFish, TKM",Waikato-Waiariki,4718,"Mokai Kainga | Ko Te Mokai | Maniapoto, Waikato | Apakura, Hikairo, Ngati Apakura | 111 Aotea Rd., Kawhia | Waikato-Waiariki","<a href=""mailto:tpkmaps@tpk.govt.nz?subject=Feedback on Mōkai Kainga - GIS_MID=221"">Send feedback on Mōkai Kainga</a>","<a href=""https://www.google.com/maps/place/-38.0357880000000,174.8395460000000/data=!3m1!1e3"">View location on Google Maps</a>"
223,Mōkau,,Huruiki,Tribal,174.343117,-35.407917,"2355 Russell Rd., Mōkau, Whangarei",Ngātiwai,Te Uri o Hikihiki,Whangarei DC,"F/S, MFish, TKM",Te Taitokerau,5424,"Mokau | Huruiki | Ngatiwai | Te Uri o Hikihiki | 2355 Russell Rd., Mokau, Whangarei | Te Taitokerau","<a href=""mailto:tpkmaps@tpk.govt.nz?subject=Feedback on Mōkau - GIS_MID=223"">Send feedback on Mōkau</a>","<a href=""https://www.google.com/maps/place/-35.4079170000000,174.3431170000000/data=!3m1!1e3"">View location on Google Maps</a>"
222,Mōkau Kohunui,,Ko Tama Tāne,Tribal,175.020233,-38.46346,"20 Moa St., Pio Pio",Maniapoto,"Apakura, Kinohaku, Waiora",whakapapa.maori.org.nz,"TKM, WWW",Waikato-Waiariki,4729,"Mokau Kohunui | Ko Tama Tane | Maniapoto | Apakura, Kinohaku, Waiora | 20 Moa St., Pio Pio | Waikato-Waiariki","<a href=""mailto:tpkmaps@tpk.govt.nz?subject=Feedback on Mōkau Kohunui - GIS_MID=222"">Send feedback on Mōkau Kohunui</a>","<a href=""https://www.google.com/maps/place/-38.4634600000000,175.0202330000000/data=!3m1!1e3"">View location on Google Maps</a>"
271,Moko (Ngāti Moko),,Mokotangatakotahi,Tribal,176.359108,-37.792906,"314 SH2, Waitangi, Te Puke",Tapuika,Ngāti Moko,Western BOP DC,"MFish, TKM",Waikato-Waiariki,5677,"Moko (Ngati Moko) | Mokotangatakotahi | Tapuika | Ngati Moko | 314 SH2, Waitangi, Te Puke | Waikato-Waiariki","<a href=""mailto:tpkmaps@tpk.govt.nz?subject=Feedback on Moko (Ngāti Moko) - GIS_MID=271"">Send feedback on Moko (Ngāti Moko)</a>","<a href=""https://www.google.com/maps/place/-37.7929060000000,176.3591080000000/data=!3m1!1e3"">View location on Google Maps</a>"
224,Mokoia,,Mokoia,Tribal,174.371585861,-39.6267044054,"State Highway 3, Mokoia",Ngāti Ruanui,Ngā Ariki,,TKM,Te Tai Hauāuru,4958,"Mokoia | Mokoia | Ngati Ruanui | Nga Ariki | State Highway 3, Mokoia | Te Tai Hauauru","<a href=""mailto:tpkmaps@tpk.govt.nz?subject=Feedback on Mokoia - GIS_MID=224"">Send feedback on Mokoia</a>","<a href=""https://www.google.com/maps/place/-39.6267044054248,174.3715858612285/data=!3m1!1e3"">View location on Google Maps</a>"
225,Mokonuiārangi,Utakura,Mokonuiārangi,Tribal,173.632809,-35.343462,"1627 Hōreke Rd., Maraeroa",Ngāpuhi,"Ngāi Tāwake ki te Moana, Ngāti Toro, Te Ngahengahe",whakapapa.maori.org.nz,"TKM, WWW",Te Taitokerau,5547,"Mokonuiarangi | Utakura | Mokonuiarangi | Ngapuhi | Ngai Tawake ki te Moana, Ngati Toro, Te Ngahengahe | 1627 Horeke Rd., Maraeroa | Te Taitokerau","<a href=""mailto:tpkmaps@tpk.govt.nz?subject=Feedback on Mokonuiārangi - GIS_MID=225"">Send feedback on Mokonuiārangi</a>","<a href=""https://www.google.com/maps/place/-35.3434620000000,173.6328090000000/data=!3m1!1e3"">View location on Google Maps</a>"
226,Mokoroa,,Ngā Roimata,Tribal,174.913249,-38.082778,"199 Bernsten Rd., Oparau, Kāwhia",Maniapoto,Ngati Kiriwai,Otorohanga DC,"MFish, TKM",Waikato-Waiariki,6185,"Mokoroa | Nga Roimata | Maniapoto | Ngati Kiriwai | 199 Bernsten Rd., Oparau, Kawhia | Waikato-Waiariki","<a href=""mailto:tpkmaps@tpk.govt.nz?subject=Feedback on Mokoroa - GIS_MID=226"">Send feedback on Mokoroa</a>","<a href=""https://www.google.com/maps/place/-38.0827780000000,174.9132490000000/data=!3m1!1e3"">View location on Google Maps</a>"
227,Mōrehu,,Kurahaupō,Tribal,173.288626,-35.335447,"10-12 Te Riha Roadway, Pawarenga",Te Rarawa,Te Uri o Tai,"terarawa.co.nz, Check location","F/S, TKM, WWW",Te Taitokerau,4791,"Morehu | Kurahaupo | Te Rarawa | Te Uri o Tai | 10-12 Te Riha Roadway, Pawarenga | Te Taitokerau","<a href=""mailto:tpkmaps@tpk.govt.nz?subject=Feedback on Mōrehu - GIS_MID=227"">Send feedback on Mōrehu</a>","<a href=""https://www.google.com/maps/place/-35.3354470000000,173.2886260000000/data=!3m1!1e3"">View location on Google Maps</a>"
228,Morero,,Hauaroa,Tribal,175.267875,-38.883259,"143 Hakiaha St., Taumarunui",Whanganui Iwi / Te Atihaunui a Pāpārangi,"Ngāti Haua, Ngāti Hekeawai",,TKM,Te Tai Hauāuru,5846,"Morero | Hauaroa | Whanganui Iwi / Te Atihaunui a Paparangi | Ngati Haua, Ngati Hekeawai | 143 Hakiaha St., Taumarunui | Te Tai Hauauru","<a href=""mailto:tpkmaps@tpk.govt.nz?subject=Feedback on Morero - GIS_MID=228"">Send feedback on Morero</a>","<a href=""https://www.google.com/maps/place/-38.8832590000000,175.2678750000000/data=!3m1!1e3"">View location on Google Maps</a>"
229,Mōria,,Mōria,Tribal,173.462533,-35.477645,"36 Whirinaki School Rd., Whirinaki, Opononi 0473 South Hokianga",Ngāpuhi,"Ngāti Kairewa, Ngāti Kerewheti, Ngāti Te Pou, Ngāti Tuapango, Te Hikutu, Te Whānau Whero",,"F/S, TKM",Te Taitokerau,5568,"Moria | Moria | Ngapuhi | Ngati Kairewa, Ngati Kerewheti, Ngati Te Pou, Ngati Tuapango, Te Hikutu, Te Whanau Whero | 36 Whirinaki School Rd., Whirinaki, Opononi 0473 South Hokianga | Te Taitokerau","<a href=""mailto:tpkmaps@tpk.govt.nz?subject=Feedback on Mōria - GIS_MID=229"">Send feedback on Mōria</a>","<a href=""https://www.google.com/maps/place/-35.4776450000000,173.4625330000000/data=!3m1!1e3"">View location on Google Maps</a>"
230,Motairehe,,Whakaruruhau,Tribal,175.377873321,-36.1177542683,"Motairehe Rd., Motairehe, Katherine Bay, Great Barrier Island","Ngāti Rehua, Ngātiwai",Ngāti Rēhua,,"F/S, TKM",Tāmaki Makaurau,5431,"Motairehe | Whakaruruhau | Ngati Rehua, Ngatiwai | Ngati Rehua | Motairehe Rd., Motairehe, Katherine Bay, Great Barrier Island | Tamaki Makaurau","<a href=""mailto:tpkmaps@tpk.govt.nz?subject=Feedback on Motairehe - GIS_MID=230"">Send feedback on Motairehe</a>","<a href=""https://www.google.com/maps/place/-36.1177542683366,175.3778733209046/data=!3m1!1e3"">View location on Google Maps</a>"
231,Mōtakotako (Taruke),Taruke Marae,Te Ōhākī a Mahuta,Tribal,174.833672,-37.935135,"Motakotako, Phillips Road, Te Mata, Raglan",Waikato,"Ngāti Mahuta, Ngāti Te Weehi, Tainui",whakapapa.maori.org.nz,"TKM, WWW",Waikato-Waiariki,5106,"Motakotako (Taruke) | Taruke Marae | Te Ohaki a Mahuta | Waikato | Ngati Mahuta, Ngati Te Weehi, Tainui | Motakotako, Phillips Road, Te Mata, Raglan | Waikato-Waiariki","<a href=""mailto:tpkmaps@tpk.govt.nz?subject=Feedback on Mōtakotako (Taruke) - GIS_MID=231"">Send feedback on Mōtakotako (Taruke)</a>","<a href=""https://www.google.com/maps/place/-37.9351350000000,174.8336720000000/data=!3m1!1e3"">View location on Google Maps</a>"
232,Mōtatau,,Manu Koroki,Tribal,174.036995,-35.490011,"103 Henare Rd., Mōtatau, Bay of Islands",Ngāpuhi,"Ngāti Hine, Ngāti Te Tāwera",,"F/S, TKM",Te Taitokerau,5506,"Motatau | Manu Koroki | Ngapuhi | Ngati Hine, Ngati Te Tawera | 103 Henare Rd., Motatau, Bay of Islands | Te Taitokerau","<a href=""mailto:tpkmaps@tpk.govt.nz?subject=Feedback on Mōtatau - GIS_MID=232"">Send feedback on Mōtatau</a>","<a href=""https://www.google.com/maps/place/-35.4900110000000,174.0369950000000/data=!3m1!1e3"">View location on Google Maps</a>"
234,Mōtītī,,Ko te Hungaiti / Hapainga,Tribal,175.121307,-38.332695,"486 Mangatea Rd., Te Kūiti",Maniapoto,"Kinohaku, Putaitemuri, Tauhunu",whakapapa.maori.org.nz,"F/S, TKM, WWW",Waikato-Waiariki,4730,"Motiti | Ko te Hungaiti / Hapainga | Maniapoto | Kinohaku, Putaitemuri, Tauhunu | 486 Mangatea Rd., Te Kuiti | Waikato-Waiariki","<a href=""mailto:tpkmaps@tpk.govt.nz?subject=Feedback on Mōtītī - GIS_MID=234"">Send feedback on Mōtītī</a>","<a href=""https://www.google.com/maps/place/-38.3326950000000,175.1213070000000/data=!3m1!1e3"">View location on Google Maps</a>"
235,Motuiti,,Rakau / Paewai,Tribal,175.299527,-40.442263,"278 SH1, Himitangi","Ngāti Raukawa ki te Tonga, Rangitāne","Ngāti Mairehau, Ngāti Rākau",whakapapa.maori.org.nz,"F/S, TKM, WWW",Te Tai Hauāuru,4916,"Motuiti | Rakau / Paewai | Ngati Raukawa ki te Tonga, Rangitane | Ngati Mairehau, Ngati Rakau | 278 SH1, Himitangi | Te Tai Hauauru","<a href=""mailto:tpkmaps@tpk.govt.nz?subject=Feedback on Motuiti - GIS_MID=235"">Send feedback on Motuiti</a>","<a href=""https://www.google.com/maps/place/-40.4422630000000,175.2995270000000/data=!3m1!1e3"">View location on Google Maps</a>"
236,Motukiore,,Arohamauora,Tribal,173.570207,-35.383967,"651 Motukiore Rd., Hōreke, South Hokianga",Ngāpuhi,"Ngāti Toro, Te Māhurehure, Te Ngahengahe",whakapapa.maori.org.nz,"TKM, WWW",Te Taitokerau,5556,"Motukiore | Arohamauora | Ngapuhi | Ngati Toro, Te Mahurehure, Te Ngahengahe | 651 Motukiore Rd., Horeke, South Hokianga | Te Taitokerau","<a href=""mailto:tpkmaps@tpk.govt.nz?subject=Feedback on Motukiore - GIS_MID=236"">Send feedback on Motukiore</a>","<a href=""https://www.google.com/maps/place/-35.3839670000000,173.5702070000000/data=!3m1!1e3"">View location on Google Maps</a>"
237,Motuti,,Tamatea,Tribal,173.405418601,-35.3886029998,"325 Motuti Road, Motuti, North Hokianga",Te Rarawa,"Ngāti Tamatea, Ngāti Te Maara, Te Kai Tutae",terarawa.co.nz,"F/S, TKM, WWW",Te Taitokerau,4785,"Motuti | Tamatea | Te Rarawa | Ngati Tamatea, Ngati Te Maara, Te Kai Tutae | 325 Motuti Road, Motuti, North Hokianga | Te Taitokerau","<a href=""mailto:tpkmaps@tpk.govt.nz?subject=Feedback on Motuti - GIS_MID=237"">Send feedback on Motuti</a>","<a href=""https://www.google.com/maps/place/-35.3886029997519,173.4054186010626/data=!3m1!1e3"">View location on Google Maps</a>"
250,Motuwairaka,Motuwairaka Inc,Destroyed by fire 2017,Tribal,176.070481,-41.08478,"274 Riversdale Road, Riversdale",Ngāti Kahungunu,Ngāi Tumapuhia-a-Rangi,kahungunu.iwi.nz,"TKM, WWW",Ikaroa-Rāwhiti,6235,"Motuwairaka | Motuwairaka Inc | Destroyed by fire 2017 | Ngati Kahungunu | Ngai Tumapuhia-a-Rangi | 274 Riversdale Road, Riversdale | Ikaroa-Rawhiti","<a href=""mailto:tpkmaps@tpk.govt.nz?subject=Feedback on Motuwairaka - GIS_MID=250"">Send feedback on Motuwairaka</a>","<a href=""https://www.google.com/maps/place/-41.0847800000000,176.0704810000000/data=!3m1!1e3"">View location on Google Maps</a>"
1014,Mount Roskill Grammar,,,Institutional,174.748108904,-36.9120417734,"Frost Rd., Mt Roskill, Auckland",,,,"Pat Park, TKM",Tāmaki Makaurau,6328,"Mount Roskill Grammar | Frost Rd., Mt Roskill, Auckland | Tamaki Makaurau","<a href=""mailto:tpkmaps@tpk.govt.nz?subject=Feedback on Mount Roskill Grammar - GIS_MID=1014"">Send feedback on Mount Roskill Grammar</a>","<a href=""https://www.google.com/maps/place/-36.9120417734347,174.7481089042428/data=!3m1!1e3"">View location on Google Maps</a>"
238,Murihiku,Waihopai Marae,Te Rakitauneke,Tribal,168.389294,-46.430057,"408 Tramway Rd., Heidelberg, Invercargill",Ngāi Tahu,Waihōpai Rūnaka,whakapapa.maori.org.nz,"F/S, TKM, WWW",Te Waipounamu,4580,"Murihiku | Waihopai Marae | Te Rakitauneke | Ngai Tahu | Waihopai Runaka | 408 Tramway Rd., Heidelberg, Invercargill | Te Waipounamu","<a href=""mailto:tpkmaps@tpk.govt.nz?subject=Feedback on Murihiku - GIS_MID=238"">Send feedback on Murihiku</a>","<a href=""https://www.google.com/maps/place/-46.4300570000000,168.3892940000000/data=!3m1!1e3"">View location on Google Maps</a>"
1063,Muriwai,,Te Poho o Tamanuhiri,Tribal,177.926357,-38.752374,"12 Tamanuhiri Road, Muriwai",Ngāi Tāmanuhiri,"Ngāi Tawehi, Ngāti Kahutia, Ngāti Rangitauwhiwhia, Ngāti Rangiwaho, Ngāti Rangiwahomatua",,TKM,Ikaroa-Rāwhiti,5056,"Muriwai | Te Poho o Tamanuhiri | Ngai Tamanuhiri | Ngai Tawehi, Ngati Kahutia, Ngati Rangitauwhiwhia, Ngati Rangiwaho, Ngati Rangiwahomatua | 12 Tamanuhiri Road, Muriwai | Ikaroa-Rawhiti","<a href=""mailto:tpkmaps@tpk.govt.nz?subject=Feedback on Muriwai - GIS_MID=1063"">Send feedback on Muriwai</a>","<a href=""https://www.google.com/maps/place/-38.7523740000000,177.9263570000000/data=!3m1!1e3"">View location on Google Maps</a>"
239,Muru Raupatu,,Muru Raupatu,Tribal,174.184480099,-39.0375800171,"231 Te Arei Road West, Bell Block, New Plymouth",Te Atiawa (Taranaki),Puketapu,Taranaki RC,"MFish, TKM",Te Tai Hauāuru,4932,"Muru Raupatu | Muru Raupatu | Te Atiawa (Taranaki) | Puketapu | 231 Te Arei Road West, Bell Block, New Plymouth | Te Tai Hauauru","<a href=""mailto:tpkmaps@tpk.govt.nz?subject=Feedback on Muru Raupatu - GIS_MID=239"">Send feedback on Muru Raupatu</a>","<a href=""https://www.google.com/maps/place/-39.0375800171472,174.1844800994504/data=!3m1!1e3"">View location on Google Maps</a>"
240,Murumurunga,,Wharepakau,Tribal,176.778571,-38.587814,"30 Minginui Road, Minginui, Murupara","Ngāti Whare, Tūhoe","Ngāti Hāmua ki Te Whaiti, Ngāti Kohiwi, Ngāti Māhanga, Ngāti Te Au, Ngāti Te Karaha, Ngāti Tuahiwi, Ngāti Whare, Ngāti Whare ki Ngā Pōtiki, Warahoe ki Te Whaiti",,"R/O, TKM",Waikato-Waiariki,6180,"Murumurunga | Wharepakau | Ngati Whare, Tuhoe | Ngati Hamua ki Te Whaiti, Ngati Kohiwi, Ngati Mahanga, Ngati Te Au, Ngati Te Karaha, Ngati Tuahiwi, Ngati Whare, Ngati Whare ki Nga Potiki, Warahoe ki Te Whaiti | 30 Minginui Road, Minginui, Murupara | Waik","<a href=""mailto:tpkmaps@tpk.govt.nz?subject=Feedback on Murumurunga - GIS_MID=240"">Send feedback on Murumurunga</a>","<a href=""https://www.google.com/maps/place/-38.5878140000000,176.7785710000000/data=!3m1!1e3"">View location on Google Maps</a>"
915,Naenae College,,Te Whānau Tahi,Institutional,174.940822,-41.195971,"Naenae College, 910 High St., Naenae, Lower Hutt",,,,"Pat Park, TKM",Te Tai Hauāuru,6394,"Naenae College | Te Whanau Tahi | Naenae College, 910 High St., Naenae, Lower Hutt | Te Tai Hauauru","<a href=""mailto:tpkmaps@tpk.govt.nz?subject=Feedback on Naenae College - GIS_MID=915"">Send feedback on Naenae College</a>","<a href=""https://www.google.com/maps/place/-41.1959710000000,174.9408220000000/data=!3m1!1e3"">View location on Google Maps</a>"
241,Napinapi,,Parekahoki,Tribal,175.055998,-38.449341,"57 Napinapi Rd., Pio Pio, Te Kuiti",Maniapoto,"Matakore, Pare te Kawa",whakapapa.maori.org.nz,"F/S, TKM, WWW",Waikato-Waiariki,4674,"Napinapi | Parekahoki | Maniapoto | Matakore, Pare te Kawa | 57 Napinapi Rd., Pio Pio, Te Kuiti | Waikato-Waiariki","<a href=""mailto:tpkmaps@tpk.govt.nz?subject=Feedback on Napinapi - GIS_MID=241"">Send feedback on Napinapi</a>","<a href=""https://www.google.com/maps/place/-38.4493410000000,175.0559980000000/data=!3m1!1e3"">View location on Google Maps</a>"
242,Naumai,,Ngā Uri o te Kotahitanga,Tribal,173.983553,-36.092765,"4936 SH12, Naumai","Ngāti Whātua, Te Uri o Hau","Ngāi Tāhuhu, Ngāti Kaiwhare, Ngāti Kauae, Ngāti Kura, Ngāti Mauku, Ngāti Rangi, Ngāti Tāhinga, Te Uri o Hau",whakapapa.maori.org.nz,"TKM, WWW",Te Taitokerau,6023,"Naumai | Nga Uri o te Kotahitanga | Ngati Whatua, Te Uri o Hau | Ngai Tahuhu, Ngati Kaiwhare, Ngati Kauae, Ngati Kura, Ngati Mauku, Ngati Rangi, Ngati Tahinga, Te Uri o Hau | 4936 SH12, Naumai | Te Taitokerau","<a href=""mailto:tpkmaps@tpk.govt.nz?subject=Feedback on Naumai - GIS_MID=242"">Send feedback on Naumai</a>","<a href=""https://www.google.com/maps/place/-36.0927650000000,173.9835530000000/data=!3m1!1e3"">View location on Google Maps</a>"
1086,Nelson College Marae,Te Ara Poutama,Te Ara Poutama,Institutional,173.277142,-41.286794,"Nelson College, 67 Waimea Road, Nelson",,,,WWW,Te Tai Hauāuru,0,"Nelson College Marae | Te Ara Poutama | Te Ara Poutama | Nelson College, 67 Waimea Road, Nelson | Te Tai Hauauru","<a href=""mailto:tpkmaps@tpk.govt.nz?subject=Feedback on Nelson College Marae - GIS_MID=1086"">Send feedback on Nelson College Marae</a>","<a href=""https://www.google.com/maps/place/-41.2867940000000,173.2771420000000/data=!3m1!1e3"">View location on Google Maps</a>"
923,Newtown School,,Ngā Māhanga,Institutional,174.779581,-41.311081,"Newtown School, Mein Street, Newtown, Wellington",,,,"Pat Park, TKM",Te Tai Hauāuru,6395,"Newtown School | Nga Mahanga | Newtown School, Mein Street, Newtown, Wellington | Te Tai Hauauru","<a href=""mailto:tpkmaps@tpk.govt.nz?subject=Feedback on Newtown School - GIS_MID=923"">Send feedback on Newtown School</a>","<a href=""https://www.google.com/maps/place/-41.3110810000000,174.7795810000000/data=!3m1!1e3"">View location on Google Maps</a>"
1026,Nga Hapu,Nga Haapu,,,174.978292904,-38.8394211423,Ohura,Ngati Maniapoto,,,Pat Park,Te Tai Hauāuru,0,Nga Hapu | Nga Haapu | Ngati Maniapoto | Ohura | Te Tai Hauauru,"<a href=""mailto:tpkmaps@tpk.govt.nz?subject=Feedback on Nga Hapu - GIS_MID=1026"">Send feedback on Nga Hapu</a>","<a href=""https://www.google.com/maps/place/-38.8394211423142,174.9782929042367/data=!3m1!1e3"">View location on Google Maps</a>"
888,Nga Hau e Wha,Marton Marae Nga Hau e Wha,,Urban,175.386916,-40.078308,"27 Marumaru St., Marton",,,,Pat Park,Te Tai Hauāuru,0,"Nga Hau e Wha | Marton Marae Nga Hau e Wha | 27 Marumaru St., Marton | Te Tai Hauauru","<a href=""mailto:tpkmaps@tpk.govt.nz?subject=Feedback on Nga Hau e Wha - GIS_MID=888"">Send feedback on Nga Hau e Wha</a>","<a href=""https://www.google.com/maps/place/-40.0783080000000,175.3869160000000/data=!3m1!1e3"">View location on Google Maps</a>"
173,Ngā Hau E Whā,,Ngā Hau E Whā,Urban,168.353595053,-46.4239285904,"193 Conon St., Invercargill",,,,"F/S, TKM",Te Waipounamu,6300,"Nga Hau E Wha | Nga Hau E Wha | 193 Conon St., Invercargill | Te Waipounamu","<a href=""mailto:tpkmaps@tpk.govt.nz?subject=Feedback on Ngā Hau E Whā - GIS_MID=173"">Send feedback on Ngā Hau E Whā</a>","<a href=""https://www.google.com/maps/place/-46.4239285903859,168.3535950532914/data=!3m1!1e3"">View location on Google Maps</a>"
243,Ngā Hau e Whā,,Ngā Hau e Whā,Tribal,174.88912,-37.190244,"88 Beatty Rd., Pukekohe","Ngāti Tamaoho, Waikato","Ngāi Tai, Ngāti Koheriki, Ngāti Tamaoho",whakapapa.maori.org.nz,"F/S, TKM, WWW",Tāmaki Makaurau,5080,"Nga Hau e Wha | Nga Hau e Wha | Ngati Tamaoho, Waikato | Ngai Tai, Ngati Koheriki, Ngati Tamaoho | 88 Beatty Rd., Pukekohe | Tamaki Makaurau","<a href=""mailto:tpkmaps@tpk.govt.nz?subject=Feedback on Ngā Hau e Whā - GIS_MID=243"">Send feedback on Ngā Hau e Whā</a>","<a href=""https://www.google.com/maps/place/-37.1902440000000,174.8891200000000/data=!3m1!1e3"">View location on Google Maps</a>"
244,Ngā Hau E Whā National,Nga Hau E Wha Marae,Aoraki,Urban,172.698477,-43.52101,"250 Pages Rd., Aranui, Christchurch",,,Christchurch CC,"F/S, MFish, TKM",Te Waipounamu,6301,"Nga Hau E Wha National | Nga Hau E Wha Marae | Aoraki | 250 Pages Rd., Aranui, Christchurch | Te Waipounamu","<a href=""mailto:tpkmaps@tpk.govt.nz?subject=Feedback on Ngā Hau E Whā National - GIS_MID=244"">Send feedback on Ngā Hau E Whā National</a>","<a href=""https://www.google.com/maps/place/-43.5210100000000,172.6984770000000/data=!3m1!1e3"">View location on Google Maps</a>"
