170,Te Manutai,,Te Manutai,Tribal,177.684278,-39.043424,"2648 SH2, Nūhaka","Ngāti Kahungunu, Te Wairoa iwi and hapu","Ngāti Kauaha, Rakaipaaka","Wairoa DC, kahungunu.iwi.nz","F/S, MFish, TKM, WWW",Ikaroa-Rāwhiti,5149,"Te Manutai | Te Manutai | Ngati Kahungunu, Te Wairoa iwi and hapu | Ngati Kauaha, Rakaipaaka | 2648 SH2, Nuhaka | Ikaroa-Rawhiti","<a href=""mailto:tpkmaps@tpk.govt.nz?subject=Feedback on Te Manutai - GIS_MID=170"">Send feedback on Te Manutai</a>","<a href=""https://www.google.com/maps/place/-39.0434240000000,177.6842780000000/data=!3m1!1e3"">View location on Google Maps</a>"
172,Te Māpou,,Rongotangiawa,Tribal,176.806705,-38.036764,"2004 SH30, Te Mapou, Te Teko",Ngāti Awa,Ngāti Hāmua,,"F/S, TKM, WWW",Waikato-Waiariki,5417,"Te Mapou | Rongotangiawa | Ngati Awa | Ngati Hamua | 2004 SH30, Te Mapou, Te Teko | Waikato-Waiariki","<a href=""mailto:tpkmaps@tpk.govt.nz?subject=Feedback on Te Māpou - GIS_MID=172"">Send feedback on Te Māpou</a>","<a href=""https://www.google.com/maps/place/-38.0367640000000,176.8067050000000/data=!3m1!1e3"">View location on Google Maps</a>"
968,Te Marae o Hine,,,,175.442339164,-40.115086685,"Kakariki, Feilding",Ngati Raukawa ki te Tonga,,,Pat Park,Te Tai Hauāuru,0,"Te Marae o Hine | Ngati Raukawa ki te Tonga | Kakariki, Feilding | Te Tai Hauauru","<a href=""mailto:tpkmaps@tpk.govt.nz?subject=Feedback on Te Marae o Hine - GIS_MID=968"">Send feedback on Te Marae o Hine</a>","<a href=""https://www.google.com/maps/place/-40.1150866850199,175.4423391644732/data=!3m1!1e3"">View location on Google Maps</a>"
1053,Te Marae o Hine,Pukekaraka,Hine Nui o te Ao Katoa; Roma,,175.142323,-40.746271,"Pukekaraka, 4 Convent Rd., Ōtaki",,,,"Pat Park, WWW",Te Tai Hauāuru,0,"Te Marae o Hine | Pukekaraka | Hine Nui o te Ao Katoa; Roma | Pukekaraka, 4 Convent Rd., Otaki | Te Tai Hauauru","<a href=""mailto:tpkmaps@tpk.govt.nz?subject=Feedback on Te Marae o Hine - GIS_MID=1053"">Send feedback on Te Marae o Hine</a>","<a href=""https://www.google.com/maps/place/-40.7462710000000,175.1423230000000/data=!3m1!1e3"">View location on Google Maps</a>"
933,Te Marae o Te Whare Takuira o Kahungunu,Eastern Institute of Technology,Te Ara Tāwhaki,Institutional,176.840005,-39.546192,"Eastern Institute of Technology, 501 Gloucester St., Taradale, Napier",,,,Pat Park,Ikaroa-Rāwhiti,6374,"Te Marae o Te Whare Takuira o Kahungunu | Eastern Institute of Technology | Te Ara Tawhaki | Eastern Institute of Technology, 501 Gloucester St., Taradale, Napier | Ikaroa-Rawhiti","<a href=""mailto:tpkmaps@tpk.govt.nz?subject=Feedback on Te Marae o Te Whare Takuira o Kahungunu - GIS_MID=933"">Send feedback on Te Marae o Te Whare Takuira o Kahungunu</a>","<a href=""https://www.google.com/maps/place/-39.5461920000000,176.8400050000000/data=!3m1!1e3"">View location on Google Maps</a>"
633,Te Maru o Hinemaka,Pararaki Marae,Pararaki,Tribal,177.888465,-37.63114,"10166 SH35, Raukokore",Te Whānau a Apanui,Te Whānau a Pararaki,,TKM,Waikato-Waiariki,5049,"Te Maru o Hinemaka | Pararaki Marae | Pararaki | Te Whanau a Apanui | Te Whanau a Pararaki | 10166 SH35, Raukokore | Waikato-Waiariki","<a href=""mailto:tpkmaps@tpk.govt.nz?subject=Feedback on Te Maru o Hinemaka - GIS_MID=633"">Send feedback on Te Maru o Hinemaka</a>","<a href=""https://www.google.com/maps/place/-37.6311400000000,177.8884650000000/data=!3m1!1e3"">View location on Google Maps</a>"
181,Te Maruata,,,Tribal,174.359398,-35.657497,"Edginton Rd., Glenbervie, Whangarei",Ngāpuhi,,Whangarei DC,"MFish, WWW",Te Taitokerau,0,"Te Maruata | Ngapuhi | Edginton Rd., Glenbervie, Whangarei | Te Taitokerau","<a href=""mailto:tpkmaps@tpk.govt.nz?subject=Feedback on Te Maruata - GIS_MID=181"">Send feedback on Te Maruata</a>","<a href=""https://www.google.com/maps/place/-35.6574970000000,174.3593980000000/data=!3m1!1e3"">View location on Google Maps</a>"
634,Te Matai (Ngāti Kurī),Tapuika Marae,Tapuika,Tribal,176.379625,-37.807066,"49 McMeeking Rd., Te Matai, Rangiuru, Te Puke",Tapuika,Ngāti Kurī,Western BOP DC,"EBOP, F/S, MFish, TKM",Waikato-Waiariki,5680,"Te Matai (Ngati Kuri) | Tapuika Marae | Tapuika | Tapuika | Ngati Kuri | 49 McMeeking Rd., Te Matai, Rangiuru, Te Puke | Waikato-Waiariki","<a href=""mailto:tpkmaps@tpk.govt.nz?subject=Feedback on Te Matai (Ngāti Kurī) - GIS_MID=634"">Send feedback on Te Matai (Ngāti Kurī)</a>","<a href=""https://www.google.com/maps/place/-37.8070660000000,176.3796250000000/data=!3m1!1e3"">View location on Google Maps</a>"
1038,Te Maungarongo,Mount Maunganui College,Tāne-nui-a-rangi,Institutional,176.206366,-37.66114,"Mount Maunganui College, Maunganui Rd., Mt. Maunganui",,,,Pat Park,Waikato-Waiariki,6360,"Te Maungarongo | Mount Maunganui College | Tane-nui-a-rangi | Mount Maunganui College, Maunganui Rd., Mt. Maunganui | Waikato-Waiariki","<a href=""mailto:tpkmaps@tpk.govt.nz?subject=Feedback on Te Maungarongo - GIS_MID=1038"">Send feedback on Te Maungarongo</a>","<a href=""https://www.google.com/maps/place/-37.6611400000000,176.2063660000000/data=!3m1!1e3"">View location on Google Maps</a>"
584,Te Maungārongo (Presbyterian),Te Hinota Marae; Ohope Marae,Te Maungārongo,Institutional,177.038128,-37.96639,"62 Pohutukawa Ave., Ohope Beach, Whakatane",,,,"EBOP, TKM",Waikato-Waiariki,6366,"Te Maungarongo (Presbyterian) | Te Hinota Marae; Ohope Marae | Te Maungarongo | 62 Pohutukawa Ave., Ohope Beach, Whakatane | Waikato-Waiariki","<a href=""mailto:tpkmaps@tpk.govt.nz?subject=Feedback on Te Maungārongo (Presbyterian) - GIS_MID=584"">Send feedback on Te Maungārongo (Presbyterian)</a>","<a href=""https://www.google.com/maps/place/-37.9663900000000,177.0381280000000/data=!3m1!1e3"">View location on Google Maps</a>"
635,Te Mira (Whetū Mārama / Mill Pā),Te Mira Marae (Whetū Mārama / Mill Pā),Mākoro,Tribal,177.41239,-38.986018,"489 Frasertown Rd., Wairoa","Ngāti Kahungunu, Te Wairoa iwi and hapu",Ngāti Mākoro,,TKM,Ikaroa-Rāwhiti,6129,"Te Mira (Whetu Marama / Mill Pa) | Te Mira Marae (Whetu Marama / Mill Pa) | Makoro | Ngati Kahungunu, Te Wairoa iwi and hapu | Ngati Makoro | 489 Frasertown Rd., Wairoa | Ikaroa-Rawhiti","<a href=""mailto:tpkmaps@tpk.govt.nz?subject=Feedback on Te Mira (Whetū Mārama / Mill Pā) - GIS_MID=635"">Send feedback on Te Mira (Whetū Mārama / Mill Pā)</a>","<a href=""https://www.google.com/maps/place/-38.9860180000000,177.4123900000000/data=!3m1!1e3"">View location on Google Maps</a>"
932,Te Ngaehe (Waitangi),Waipuka Reserve,,,176.98448,-39.797714,"111 Waitangi Rd., Waimarama",Hawkes Bay - Wairarapa,,,Pat Park,Ikaroa-Rāwhiti,0,"Te Ngaehe (Waitangi) | Waipuka Reserve | Hawkes Bay - Wairarapa | 111 Waitangi Rd., Waimarama | Ikaroa-Rawhiti","<a href=""mailto:tpkmaps@tpk.govt.nz?subject=Feedback on Te Ngaehe (Waitangi) - GIS_MID=932"">Send feedback on Te Ngaehe (Waitangi)</a>","<a href=""https://www.google.com/maps/place/-39.7977140000000,176.9844800000000/data=!3m1!1e3"">View location on Google Maps</a>"
637,Te Ngaere,,Ngāi Tupango te Hapū,Tribal,173.87451,-35.029957,"Te Ngaere Rd., Te Ngaere Bay",Ngāpuhi / Ngāti Kahu ki Whaingaroa,Ngaitupango,,"F/S, TKM",Te Taitokerau,4606,"Te Ngaere | Ngai Tupango te Hapu | Ngapuhi / Ngati Kahu ki Whaingaroa | Ngaitupango | Te Ngaere Rd., Te Ngaere Bay | Te Taitokerau","<a href=""mailto:tpkmaps@tpk.govt.nz?subject=Feedback on Te Ngaere - GIS_MID=637"">Send feedback on Te Ngaere</a>","<a href=""https://www.google.com/maps/place/-35.0299570000000,173.8745100000000/data=!3m1!1e3"">View location on Google Maps</a>"
639,Te Ōhākī,,Te Ōhākī,Tribal,175.86258,-37.795928,"31A Douglas Rd., Okauia, Matamata",Ngāti Hinerangi,"Ngāti Kura, Ngāti Te Riha, Ngāti Tokotoko, Ngāti Whakamaungarangi",whakapapa.maori.org.nz,"TKM, WWW",Waikato-Waiariki,6074,"Te Ohaki | Te Ohaki | Ngati Hinerangi | Ngati Kura, Ngati Te Riha, Ngati Tokotoko, Ngati Whakamaungarangi | 31A Douglas Rd., Okauia, Matamata | Waikato-Waiariki","<a href=""mailto:tpkmaps@tpk.govt.nz?subject=Feedback on Te Ōhākī - GIS_MID=639"">Send feedback on Te Ōhākī</a>","<a href=""https://www.google.com/maps/place/-37.7959280000000,175.8625800000000/data=!3m1!1e3"">View location on Google Maps</a>"
641,Te Ōhākī,,Te Ōhākī a Te Puea,Tribal,175.151682,-37.529685,"212 Te Ōhakī Road, Te Ōhakī",Waikato,"Ngāti Kuiaarangi, Ngāti Mahuta, Ngāti Tai, Ngāti Whāwhākia",,TKM,Waikato-Waiariki,6168,"Te Ohaki | Te Ohaki a Te Puea | Waikato | Ngati Kuiaarangi, Ngati Mahuta, Ngati Tai, Ngati Whawhakia | 212 Te Ohaki Road, Te Ohaki | Waikato-Waiariki","<a href=""mailto:tpkmaps@tpk.govt.nz?subject=Feedback on Te Ōhākī - GIS_MID=641"">Send feedback on Te Ōhākī</a>","<a href=""https://www.google.com/maps/place/-37.5296850000000,175.1516820000000/data=!3m1!1e3"">View location on Google Maps</a>"
642,Te Omeka,,Tiriki Teihaua,Tribal,175.880956,-37.866779,"1133 Tauranga Rd., Te Poi",Raukawa,Ngāti Kirihika,,TKM,Waikato-Waiariki,6231,"Te Omeka | Tiriki Teihaua | Raukawa | Ngati Kirihika | 1133 Tauranga Rd., Te Poi | Waikato-Waiariki","<a href=""mailto:tpkmaps@tpk.govt.nz?subject=Feedback on Te Omeka - GIS_MID=642"">Send feedback on Te Omeka</a>","<a href=""https://www.google.com/maps/place/-37.8667790000000,175.8809560000000/data=!3m1!1e3"">View location on Google Maps</a>"
643,Te Oreore,Ngā Tau e Waru,Ngā Tau e Waru,Tribal,175.700883,-40.943282,"81 Te Ore Ore-Bideford Rd., Masterton","Ngāti Kahungunu, Rangitāne","Hinetearorangi, Kahukuraawhitia, Kahukuranui, Ngāi Tamahau, Ngāti Hāmua, Ngāti Taimahu, Ngāti Tangatakau, Ngāti Te Hina, Ngāti Te Noti, Ngāti Te Raetea, Ngāti Te Whātui, Tahu o Kahungunu, Tamahau, Whiunga","Masterton DC, kahungunu.iwi.nz","F/S, MFish, TKM, WWW",Ikaroa-Rāwhiti,5269,"Te Oreore | Nga Tau e Waru | Nga Tau e Waru | Ngati Kahungunu, Rangitane | Hinetearorangi, Kahukuraawhitia, Kahukuranui, Ngai Tamahau, Ngati Hamua, Ngati Taimahu, Ngati Tangatakau, Ngati Te Hina, Ngati Te Noti, Ngati Te Raetea, Ngati Te Whatui, Tahu o Ka","<a href=""mailto:tpkmaps@tpk.govt.nz?subject=Feedback on Te Oreore - GIS_MID=643"">Send feedback on Te Oreore</a>","<a href=""https://www.google.com/maps/place/-40.9432820000000,175.7008830000000/data=!3m1!1e3"">View location on Google Maps</a>"
902,Te Oruanui,,No wharenui,Urban,167.957938465,-45.933988814,"21 Hastings St., Ohai",,,Pan tribal,"Pat Park, TKM",Te Waipounamu,6305,"Te Oruanui | No wharenui | 21 Hastings St., Ohai | Te Waipounamu","<a href=""mailto:tpkmaps@tpk.govt.nz?subject=Feedback on Te Oruanui - GIS_MID=902"">Send feedback on Te Oruanui</a>","<a href=""https://www.google.com/maps/place/-45.9339888140048,167.9579384645214/data=!3m1!1e3"">View location on Google Maps</a>"
644,Te Oruoru,,Te Oruoru,Tribal,173.899002227,-35.682191948,"Mangakāhia Road, Pakōtai",Ngāpuhi,"Ngāti Horahia, Ngāti Moe, Ngāti Te Rino, Ngāti Toki, Te Kumutu",,TKM,Te Taitokerau,5497,"Te Oruoru | Te Oruoru | Ngapuhi | Ngati Horahia, Ngati Moe, Ngati Te Rino, Ngati Toki, Te Kumutu | Mangakahia Road, Pakotai | Te Taitokerau","<a href=""mailto:tpkmaps@tpk.govt.nz?subject=Feedback on Te Oruoru - GIS_MID=644"">Send feedback on Te Oruoru</a>","<a href=""https://www.google.com/maps/place/-35.6821919480226,173.8990022270258/data=!3m1!1e3"">View location on Google Maps</a>"
645,Te Pā a Parore,,Te Pā A Parore,Tribal,173.216472735,-34.9991704987,"168 Paparore Rd., Awanui, Kaitaia",Ngāi Takoto,,,"Te Paamu Marae, TKM",Te Taitokerau,4585,"Te Pa a Parore | Te Pa A Parore | Ngai Takoto | 168 Paparore Rd., Awanui, Kaitaia | Te Taitokerau","<a href=""mailto:tpkmaps@tpk.govt.nz?subject=Feedback on Te Pā a Parore - GIS_MID=645"">Send feedback on Te Pā a Parore</a>","<a href=""https://www.google.com/maps/place/-34.9991704987331,173.2164727354711/data=!3m1!1e3"">View location on Google Maps</a>"
646,Te Paamu,Tia Marae,Tia,Tribal,176.373461,-37.802475,"20 Malcolm Ave., Rangiuru Rd., Rangiuru, Te Puke",Tapuika,Ngāti Marukukere,Western BOP DC,"EBOP, MFish, TKM",Waikato-Waiariki,5679,"Te Paamu | Tia Marae | Tia | Tapuika | Ngati Marukukere | 20 Malcolm Ave., Rangiuru Rd., Rangiuru, Te Puke | Waikato-Waiariki","<a href=""mailto:tpkmaps@tpk.govt.nz?subject=Feedback on Te Paamu - GIS_MID=646"">Send feedback on Te Paamu</a>","<a href=""https://www.google.com/maps/place/-37.8024750000000,176.3734610000000/data=!3m1!1e3"">View location on Google Maps</a>"
647,Te Paatu,,Piri ki Te Paatu,Tribal,173.341164,-35.129488,"7075 SH1, Pamāpūria, Kaitaia",Ngāti Kahu,Te Paatu ki Pamāpūria,,"TKM, WWW",Te Taitokerau,4600,"Te Paatu | Piri ki Te Paatu | Ngati Kahu | Te Paatu ki Pamapuria | 7075 SH1, Pamapuria, Kaitaia | Te Taitokerau","<a href=""mailto:tpkmaps@tpk.govt.nz?subject=Feedback on Te Paatu - GIS_MID=647"">Send feedback on Te Paatu</a>","<a href=""https://www.google.com/maps/place/-35.1294880000000,173.3411640000000/data=!3m1!1e3"">View location on Google Maps</a>"
648,Te Paea o Hauraki,,Te Paea,Tribal,175.550019,-36.673174,"1361 Kennedy Bay Rd., Kennedy Bay, Coromandel",Ngāti Tamaterā,,whakapapa.maori.org.nz,"TKM, WWW",Waikato-Waiariki,6253,"Te Paea o Hauraki | Te Paea | Ngati Tamatera | 1361 Kennedy Bay Rd., Kennedy Bay, Coromandel | Waikato-Waiariki","<a href=""mailto:tpkmaps@tpk.govt.nz?subject=Feedback on Te Paea o Hauraki - GIS_MID=648"">Send feedback on Te Paea o Hauraki</a>","<a href=""https://www.google.com/maps/place/-36.6731740000000,175.5500190000000/data=!3m1!1e3"">View location on Google Maps</a>"
649,Te Paemate,,,Tribal,174.992272,-38.562609,"66 Ohura Road, Āria",Maniapoto,Paemate,,TKM,Waikato-Waiariki,4766,"Te Paemate | Maniapoto | Paemate | 66 Ohura Road, Aria | Waikato-Waiariki","<a href=""mailto:tpkmaps@tpk.govt.nz?subject=Feedback on Te Paemate - GIS_MID=649"">Send feedback on Te Paemate</a>","<a href=""https://www.google.com/maps/place/-38.5626090000000,174.9922720000000/data=!3m1!1e3"">View location on Google Maps</a>"
651,Te Pai o Hauraki,,Te Pai o Hauraki,Tribal,175.665172,-37.389337,"3 Papaturoa Ave., Awapu, Paeroa",Ngāti Tamaterā,,,"F/S, TKM",Waikato-Waiariki,6116,"Te Pai o Hauraki | Te Pai o Hauraki | Ngati Tamatera | 3 Papaturoa Ave., Awapu, Paeroa | Waikato-Waiariki","<a href=""mailto:tpkmaps@tpk.govt.nz?subject=Feedback on Te Pai o Hauraki - GIS_MID=651"">Send feedback on Te Pai o Hauraki</a>","<a href=""https://www.google.com/maps/place/-37.3893370000000,175.6651720000000/data=!3m1!1e3"">View location on Google Maps</a>"
652,Te Pākira,Wahiao Marae,Wahiao,Tribal,176.256723,-38.162138,"2 Hinganoa Drive., Whakarewarewa Village, Rotorua",Tūhourangi,"Ngāti Puta, Ngāti Taoi, Ngāti Uruhina, Ngāti Wahiao, Tūhourangi",,"EBOP, F/S, TKM",Waikato-Waiariki,5645,"Te Pakira | Wahiao Marae | Wahiao | Tuhourangi | Ngati Puta, Ngati Taoi, Ngati Uruhina, Ngati Wahiao, Tuhourangi | 2 Hinganoa Drive., Whakarewarewa Village, Rotorua | Waikato-Waiariki","<a href=""mailto:tpkmaps@tpk.govt.nz?subject=Feedback on Te Pākira - GIS_MID=652"">Send feedback on Te Pākira</a>","<a href=""https://www.google.com/maps/place/-38.1621380000000,176.2567230000000/data=!3m1!1e3"">View location on Google Maps</a>"
653,Te Papa o Rotu (Te Oneparepare),Oneparepare Marae,Papa o Rotu,Tribal,175.146403,-37.788734,"145 Maori Point Rd., Whatawhata, Hamilton",Waikato,"Ngāti Māhanga, Ngāti Tamainupo","Waikato DC (Papaoroto Marae), whakapapa.maori.org.nz","F/S, MFish, TKM, WWW",Waikato-Waiariki,5122,"Te Papa o Rotu (Te Oneparepare) | Oneparepare Marae | Papa o Rotu | Waikato | Ngati Mahanga, Ngati Tamainupo | 145 Maori Point Rd., Whatawhata, Hamilton | Waikato-Waiariki","<a href=""mailto:tpkmaps@tpk.govt.nz?subject=Feedback on Te Papa o Rotu (Te Oneparepare) - GIS_MID=653"">Send feedback on Te Papa o Rotu (Te Oneparepare)</a>","<a href=""https://www.google.com/maps/place/-37.7887340000000,175.1464030000000/data=!3m1!1e3"">View location on Google Maps</a>"
910,Te Papa Tongarewa,,Te Hono ki Hawaiki,Institutional,174.782579,-41.28986,"Te Papa, Cable St., Wellington",,,,"Pat Park, TKM",Te Tai Hauāuru,6402,"Te Papa Tongarewa | Te Hono ki Hawaiki | Te Papa, Cable St., Wellington | Te Tai Hauauru","<a href=""mailto:tpkmaps@tpk.govt.nz?subject=Feedback on Te Papa Tongarewa - GIS_MID=910"">Send feedback on Te Papa Tongarewa</a>","<a href=""https://www.google.com/maps/place/-41.2898600000000,174.7825790000000/data=!3m1!1e3"">View location on Google Maps</a>"
654,Te Papaiouru,,Tamatekapua,Tribal,176.248557,-38.128455,"Hurunga Street, Ōhinemutu",Te Ure o Uenukukōpako / Ngāti Whakaue,"Ngāti Hurunga Te Rangi, Ngāti Pūkaki, Ngāti Taeotu, Ngāti Te Rangiwaho, Ngāti te Roro o te Rangi, Ngāti Tunohopu",,"EBOP, TKM",Waikato-Waiariki,5699,"Te Papaiouru | Tamatekapua | Te Ure o Uenukukopako / Ngati Whakaue | Ngati Hurunga Te Rangi, Ngati Pukaki, Ngati Taeotu, Ngati Te Rangiwaho, Ngati te Roro o te Rangi, Ngati Tunohopu | Hurunga Street, Ohinemutu | Waikato-Waiariki","<a href=""mailto:tpkmaps@tpk.govt.nz?subject=Feedback on Te Papaiouru - GIS_MID=654"">Send feedback on Te Papaiouru</a>","<a href=""https://www.google.com/maps/place/-38.1284550000000,176.2485570000000/data=!3m1!1e3"">View location on Google Maps</a>"
655,Te Papatapu (Te Wehi),Te Wehi Marae,Pare Whakarukuruku,Tribal,174.868146,-37.947304,"1014 Te Papatapu Rd., Aotea",Waikato,"Ngāti Mahuta, Ngāti Te Weehi",,TKM,Waikato-Waiariki,5105,"Te Papatapu (Te Wehi) | Te Wehi Marae | Pare Whakarukuruku | Waikato | Ngati Mahuta, Ngati Te Weehi | 1014 Te Papatapu Rd., Aotea | Waikato-Waiariki","<a href=""mailto:tpkmaps@tpk.govt.nz?subject=Feedback on Te Papatapu (Te Wehi) - GIS_MID=655"">Send feedback on Te Papatapu (Te Wehi)</a>","<a href=""https://www.google.com/maps/place/-37.9473040000000,174.8681460000000/data=!3m1!1e3"">View location on Google Maps</a>"
656,Te Pātūnga,,Te Watea,Tribal,173.703512,-35.11915,"585 Pupuke-Mangape Rd., Kāeo",Ngāpuhi / Ngāti Kahu ki Whaingaroa,"Ngāti Pākahi, Ngāti Uru, Te Aeto, Whānau Pani",,TKM,Te Taitokerau,4617,"Te Patunga | Te Watea | Ngapuhi / Ngati Kahu ki Whaingaroa | Ngati Pakahi, Ngati Uru, Te Aeto, Whanau Pani | 585 Pupuke-Mangape Rd., Kaeo | Te Taitokerau","<a href=""mailto:tpkmaps@tpk.govt.nz?subject=Feedback on Te Pātūnga - GIS_MID=656"">Send feedback on Te Pātūnga</a>","<a href=""https://www.google.com/maps/place/-35.1191500000000,173.7035120000000/data=!3m1!1e3"">View location on Google Maps</a>"
1077,Te Peka,,No wharenui,Tribal,175.253015,-38.884262,"Hospital Hill, Taumarunui",Ngāti Hāua (Upper Whanganui),Ngāti Hekeāwai,,"TKM, WWW",Te Tai Hauāuru,6428,"Te Peka | No wharenui | Ngati Haua (Upper Whanganui) | Ngati Hekeawai | Hospital Hill, Taumarunui | Te Tai Hauauru","<a href=""mailto:tpkmaps@tpk.govt.nz?subject=Feedback on Te Peka - GIS_MID=1077"">Send feedback on Te Peka</a>","<a href=""https://www.google.com/maps/place/-38.8842620000000,175.2530150000000/data=!3m1!1e3"">View location on Google Maps</a>"
657,Te Piringatahi O Te Maungarongo,,Te Haumoana,Urban,174.627365,-36.816308,"17-19 Luckens Road, West Harbour, Waitakere City",,,"Waitakere CC, whakapapa.maori.org.nz","F/S, MFish, TKM, WWW",Tāmaki Makaurau,6276,"Te Piringatahi O Te Maungarongo | Te Haumoana | 17-19 Luckens Road, West Harbour, Waitakere City | Tamaki Makaurau","<a href=""mailto:tpkmaps@tpk.govt.nz?subject=Feedback on Te Piringatahi O Te Maungarongo - GIS_MID=657"">Send feedback on Te Piringatahi O Te Maungarongo</a>","<a href=""https://www.google.com/maps/place/-36.8163080000000,174.6273650000000/data=!3m1!1e3"">View location on Google Maps</a>"
658,Te Piruru Papakainga,,Te Pukenui o Taonui,Tribal,175.174563633,-38.3405277009,"62 Waitete Road, Te Kūiti",Maniapoto,Rōrā,,"F/S, TKM",Waikato-Waiariki,4686,"Te Piruru Papakainga | Te Pukenui o Taonui | Maniapoto | Rora | 62 Waitete Road, Te Kuiti | Waikato-Waiariki","<a href=""mailto:tpkmaps@tpk.govt.nz?subject=Feedback on Te Piruru Papakainga - GIS_MID=658"">Send feedback on Te Piruru Papakainga</a>","<a href=""https://www.google.com/maps/place/-38.3405277009450,175.1745636334969/data=!3m1!1e3"">View location on Google Maps</a>"
998,Te Pīti (Ōmanaia),,Te Piiti,Tribal,173.52499,-35.453006,"24 Ōmanaia Rd., Ōmanaia, South Hokianga",Ngāpuhi,"Ngāti Hau, Ngāti Te Pou",,"Pat Park, TKM",Te Taitokerau,5571,"Te Piti (Omanaia) | Te Piiti | Ngapuhi | Ngati Hau, Ngati Te Pou | 24 Omanaia Rd., Omanaia, South Hokianga | Te Taitokerau","<a href=""mailto:tpkmaps@tpk.govt.nz?subject=Feedback on Te Pīti (Ōmanaia) - GIS_MID=998"">Send feedback on Te Pīti (Ōmanaia)</a>","<a href=""https://www.google.com/maps/place/-35.4530060000000,173.5249900000000/data=!3m1!1e3"">View location on Google Maps</a>"
660,Te Poho o Rawiri,,Te Poho o Rawiri,Tribal,178.035758,-38.675487,"24 Ranfurly St., Kaitī",Ngāti Porou,"Ngāti Konohi, Ngāti Oneone",Gisborne DC,"F/S, MFish, TKM",Ikaroa-Rāwhiti,5723,"Te Poho o Rawiri | Te Poho o Rawiri | Ngati Porou | Ngati Konohi, Ngati Oneone | 24 Ranfurly St., Kaiti | Ikaroa-Rawhiti","<a href=""mailto:tpkmaps@tpk.govt.nz?subject=Feedback on Te Poho o Rawiri - GIS_MID=660"">Send feedback on Te Poho o Rawiri</a>","<a href=""https://www.google.com/maps/place/-38.6754870000000,178.0357580000000/data=!3m1!1e3"">View location on Google Maps</a>"
662,Te Poho o Tanikena,Opuatia Marae,To be confirmed,Tribal,174.958825,-37.447992,"2499 Highway 22, Glen Murray, Tuakau",Waikato,"Ngāti Tāhinga, Ngāti Taratikitiki, Tainui",,TKM,Tāmaki Makaurau,5139,"Te Poho o Tanikena | Opuatia Marae | To be confirmed | Waikato | Ngati Tahinga, Ngati Taratikitiki, Tainui | 2499 Highway 22, Glen Murray, Tuakau | Tamaki Makaurau","<a href=""mailto:tpkmaps@tpk.govt.nz?subject=Feedback on Te Poho o Tanikena - GIS_MID=662"">Send feedback on Te Poho o Tanikena</a>","<a href=""https://www.google.com/maps/place/-37.4479920000000,174.9588250000000/data=!3m1!1e3"">View location on Google Maps</a>"
663,Te Poho o Te Rehu (Te Rehu),,Te Poho o Te Rehu,Tribal,177.762664634,-39.0255003678,"24 Mataraua Rd., - Pomana Pā Road, Nūhaka","Ngāti Kahungunu, Te Wairoa iwi and hapu","Ngāi Te Rehu, Ngāti Rangi, Rakaipaaka",kahungunu.iwi.nz,"F/S, TKM, WWW",Ikaroa-Rāwhiti,5152,"Te Poho o Te Rehu (Te Rehu) | Te Poho o Te Rehu | Ngati Kahungunu, Te Wairoa iwi and hapu | Ngai Te Rehu, Ngati Rangi, Rakaipaaka | 24 Mataraua Rd., - Pomana Pa Road, Nuhaka | Ikaroa-Rawhiti","<a href=""mailto:tpkmaps@tpk.govt.nz?subject=Feedback on Te Poho o Te Rehu (Te Rehu) - GIS_MID=663"">Send feedback on Te Poho o Te Rehu (Te Rehu)</a>","<a href=""https://www.google.com/maps/place/-39.0255003678183,177.7626646336956/data=!3m1!1e3"">View location on Google Maps</a>"
664,Te Pōtaka,,Te Pōtaka,Tribal,173.809319967,-39.3674906172,"5340 Surf Highway 45, Ōaonui",Taranaki,"Ngāti Haupoto, Ngāti Tara, Ngāti Tuhekerangi","Taranaki RC, whakapapa.maori.org.nz","MFish, TKM, WWW",Te Tai Hauāuru,5967,"Te Potaka | Te Potaka | Taranaki | Ngati Haupoto, Ngati Tara, Ngati Tuhekerangi | 5340 Surf Highway 45, Oaonui | Te Tai Hauauru","<a href=""mailto:tpkmaps@tpk.govt.nz?subject=Feedback on Te Pōtaka - GIS_MID=664"">Send feedback on Te Pōtaka</a>","<a href=""https://www.google.com/maps/place/-39.3674906171653,173.8093199668421/data=!3m1!1e3"">View location on Google Maps</a>"
665,Te Poti,,Te Koanga Rehua,Tribal,175.045849,-39.484074,"Te Poti, Rangiahua, Pipiriki, Whanganui River",Whanganui Iwi / Te Atihaunui a Pāpārangi,Ngāti Tūhoro,whakapapa.maori.org.nz,"TKM, WWW",Te Tai Hauāuru,5820,"Te Poti | Te Koanga Rehua | Whanganui Iwi / Te Atihaunui a Paparangi | Ngati Tuhoro | Te Poti, Rangiahua, Pipiriki, Whanganui River | Te Tai Hauauru","<a href=""mailto:tpkmaps@tpk.govt.nz?subject=Feedback on Te Poti - GIS_MID=665"">Send feedback on Te Poti</a>","<a href=""https://www.google.com/maps/place/-39.4840740000000,175.0458490000000/data=!3m1!1e3"">View location on Google Maps</a>"
666,Te Pou ā Hīnau,Pouāhīnau,Tūranga Pikitoi,Tribal,177.087319,-38.172764,"344C Hodges Road, Waimana, Whakatane",Tūhoe,Tūranga Pikitoi,EBOP,"EBOP, R/O, TKM",Waikato-Waiariki,6147,"Te Pou a Hinau | Pouahinau | Turanga Pikitoi | Tuhoe | Turanga Pikitoi | 344C Hodges Road, Waimana, Whakatane | Waikato-Waiariki","<a href=""mailto:tpkmaps@tpk.govt.nz?subject=Feedback on Te Pou ā Hīnau - GIS_MID=666"">Send feedback on Te Pou ā Hīnau</a>","<a href=""https://www.google.com/maps/place/-38.1727640000000,177.0873190000000/data=!3m1!1e3"">View location on Google Maps</a>"
669,Te Pou o Rongo,,Tūmanako,Tribal,175.10749,-39.584207,"4517 Whanganui River Road, Rānana","Whanganui Iwi / Te Atihaunui a Pāpārangi, Whanganui Land Settlement (Lower Whanganui)","Ngāti Hine Korako, Ngāti Ruakā",,TKM,Te Tai Hauāuru,5818,"Te Pou o Rongo | Tumanako | Whanganui Iwi / Te Atihaunui a Paparangi, Whanganui Land Settlement (Lower Whanganui) | Ngati Hine Korako, Ngati Ruaka | 4517 Whanganui River Road, Ranana | Te Tai Hauauru","<a href=""mailto:tpkmaps@tpk.govt.nz?subject=Feedback on Te Pou o Rongo - GIS_MID=669"">Send feedback on Te Pou o Rongo</a>","<a href=""https://www.google.com/maps/place/-39.5842070000000,175.1074900000000/data=!3m1!1e3"">View location on Google Maps</a>"
914,Te Pou o Tainui (Tainui),Tainui,Kapumanawawhiti,Tribal,175.143765,-40.744793,"20 Convent Rd., Ōtaki",Ngāti Raukawa ki te Tonga,Ngāti Kapumanawawhiti,,"Pat Park, TKM",Te Tai Hauāuru,5019,"Te Pou o Tainui (Tainui) | Tainui | Kapumanawawhiti | Ngati Raukawa ki te Tonga | Ngati Kapumanawawhiti | 20 Convent Rd., Otaki | Te Tai Hauauru","<a href=""mailto:tpkmaps@tpk.govt.nz?subject=Feedback on Te Pou o Tainui (Tainui) - GIS_MID=914"">Send feedback on Te Pou o Tainui (Tainui)</a>","<a href=""https://www.google.com/maps/place/-40.7447930000000,175.1437650000000/data=!3m1!1e3"">View location on Google Maps</a>"
